Business Name,Address,Phone,Services / Products,Website,Minority Type,Status,Kentucky Based
"Oscar Robertson Document Management Services, LLC","N/A, Cincinnati, OH, N/A",513-307-1107,"Provides enterprise, process and content management software solutions, as well as document scanning, archiving and cloud storage, print production services and onsite managed print services (MPS), and multifunctional printers and copiers",https://www.orsolutions.com,Minority-Owned (general),Active,No
"Overflow Services, LLC","2110 Reynolds Lane, Louisville, KY, 40218",502-807-6450,"Plumbing Services, Kitchen & Bathroom remodeling;",http://www:overflowplumbing.com,Minority-Owned (general),Inactive,Yes
P & G CONSTRUCTION CO.,"1217 Buffalo Creek Road, Huntington, WV, 25704",(304) 429-1663 or (304) 634-4211 Fax: (304) 429-1664,"Related Services: 237310 - Specializing in concrete paving (i.e., highway, road, street, public sidewalk); curbs and street gutters, highway, road and street, construction; sidewalk, public, construction; 237990 - Specializing in drainage canal and ditch construction; drainage project construction; ",https://N/A,Women-Owned,Inactive,No
"PARAMOUNT SAFETY, LLC","1614 Algonquin Parkway, #19, Louisville, KY, 40210",(502) 553-4523 Fax: (502) 368-9775,Related Services: 611699 - Specializing in CPR training and certification and first aid instruction and 611710 - Specializing in educational consultants and support services,https://www.paramountsafety.us,Black-Owned,Active,Yes
"PEMCCO, INC.","PO Box 8981, Virginia Beach, VA, 23450",(757) 301-0602 or (757) 437-8862 Fax: (757) 437-8835,"Related Services: 488490 - Specializing in Bridge, tunnel, and highway operations; 541512 – Specializing in Computer hardware consulting; Computer software consulting; Computer systems integration analysis and design; Computer systems integrator services; Information management computer systems inte",https://www.pemcco.com,Black-Owned,Inactive,No
"PERFORMANCE EXTERIORS, INC.","2400 Arnoldtown Woods Road, Louisville, KY, 40214",(502) 935-5521 or (502) 817-4381 Fax: (502) 935-5567,"Related Services: 238140 - Specializing in brick and stone veneer, EIFS and caulking",https://www.performanceexterior.com,Women-Owned,Inactive,Yes
"PHILMOR CONTRACTING, INC.","8363 Veterans Memorial Hwy., Sharpsburg, KY, 40374",(606) 247-2413,"Related Services: 238910 - Specializing in Blast hole drilling (except mining), Blasting, construction site, Construction equipment (except crane) rental with operator, Dirt moving for construction, Equipment rental (except crane), construction, with operator, Excavating, earthmoving, or land cleari",https://N/A,Women-Owned,Inactive,Yes
PLC Automation,"N/A, Manvel, TX, N/A",713-557 8998,"Programmable logic controllers based on process control, automation, and customized professional training",,Women-Owned,No Website,No
"PLEASANT NEWS, INC.","1201 E. Hector Street, Conshohocken, NJ, 19428",(267) 784-4082,"Concessionaire: 424310 - Piece Goods, Notions, and Other Dry Goods Merchant Wholesalers; 424920 - Book, Periodical, and Newspaper Merchant Wholesalers;448110 - Men's Clothing Stores; 448120 - Women's Clothing Stores; 448150 - Clothing accessories stores; 448310 - Jewelry Stores; 451211 - Book stores",https://N/A,Black-Owned,Inactive,No
"POWELL VALLEY STONE CO., INC.","PO Box 10, Dryden, VA, 24243",(276) 546-2550 Fax: (276) 546-2755,Related Services: 212311 – Dimension Stone Mining and Quarrying,https://N/A,Women-Owned,Inactive,No
"POZZOLANIC CONTRACTING & SUPPLY CO., INC.","PO Box 14186, Knoxville, TN, 37914",(865) 225-0090 Fax: (865) 225-0095,"Related Services: 237310 - Specializing in soil stabilization and reclamation

Prequalified: lime and cement road bed soil stabilization",https://www.pozz.com,Women-Owned,Active,No
"PRO-MARK, INC.","PO Box 1421, Mt. Sterling, KY, 40353",(859) 497-0533 Fax: (859) 498-7827,"Related Services: 237310 - Specializing in Airport runway line painting (e.g., striping), Highway line painting, Painting lines on highways, streets, and bridges, painting traffic lanes or parking lots, Parking lot marking and line painting, Runway, airport, line painting (e.g., striping), Sign erec",https://N/A,Women-Owned,Inactive,Yes
"PROMETHEUS FOUNDRY, LLC d/b/a PROMETHEUS ART","PO Box 12023, Lexington, KY, 40579",(859) 382-7130 or (502) 592-3774,"Related Services: 238190 – Specializing in decorative steel and ornamental metal work installation; 331529 – Specializing in bronze and nonferrous metal (except aluminum) foundries, copper alloy castings, and investment casting; 332323 – Specializing in architectural metal work, ornamental balcony r",https://www.prometheusart.com,Women-Owned,Active,Yes
"PSD EXECUTIVE PROTECTION SPECIALISTS, LLC","PO Box 206163, Louisville, KY, 40250",(502) 822-6617 or (267) 325-0999,"Concessionaire/Related Services: 524291 – Specializing in cause-of-loss investigators, insurance; claims adjusting, insurance; fire investigators; insurance claims adjusting; insurance claims investigation services; and loss control consultants; 541690 - Specializing in safety consulting services an",https://www.PSDExecutiveProtection.com,Black-Owned,Active,Yes
"PSRI Technologies, LLC","N/A, Chesterfield, MO, N/A",636-778-3434,"Information technology, IT development services, staffing, and project management, and HP, Dell and Lenovo reseller",https://psritech.com/,"Minority-Owned (general), Women-Owned",Active,No
"PUSH 4J CONSTRUCTION COMPANY, LLC","333 N. Main Street, Dyer, TN, 38330",(731) 692-2526 or (731) 692-2527 Fax: (731) 692-2528,Related Services: 238110 - Poured Concrete Foundation and Structure Contractors; and 238990 - All Other Specialty Trade Contractors,https://N/A,Black-Owned,Inactive,No
"Paladin, Inc.","121 Old Lafayette Ave., Lexington, KY, 40502",859-252-3047,Engineering Services,http://www.paladinengineers.com,Women-Owned,Inactive,Yes
"Paladin, Inc.","N/A, Lexington, KY, N/A",859-252-3047,"Building commissioning & LEED; testing for  building enclosure & engineered systems; technical & consulting services to include: conditions assessments, sustainability consulting, 3-d coordination & scanning, controls integration, project management, owner’s representation & project coordination",https://www.PaladinEngineers.com,Women-Owned,Inactive,Yes
"Paradise Island Tea, LLC","8913 Stone Green Way, STE 101, Louisville, KY, 40220",502-813-1014,"Paradise Island Tea is a bottled tea company. We are manufactured here in Louisville, KY. We sell to retail outlets and at farmers markets, festivals, shows and events.",http://www.paradiseislandtea.com,Minority-Owned (general),Active,Yes
Patton Unlimited,"931 Commerce Drive, Leitchfield, KY, 42754",270-230-0221,"Playground Equipment, Shelters & Design Services;",http://www.miraclekytn.com,Women-Owned,Active,Yes
Patton Unlimited Inc. dba Miracle of KY/TN,"N/A, Leitchfield, KY, N/A",270-230-0221,Playground equipment sales & installation,https://www.miraclekytn.com,Women-Owned,Active,Yes
"Paulie's Services, LLC","N/A, Louisville, KY, N/A",502-416-4153,"Plumbing & gas installation, residential & commercial",,Minority-Owned (general),No Website,Yes
Paulies Plumbing Services LLC,"2925 Dixie Hwy, Louisville, KY, 40216",502-416-4153,Plumbing: Commercial and Residential,,Minority-Owned (general),No Website,Yes
"Payne III Enterprise, LLC","3426 N. Winthrop Ave., Indianapolis, IN, 46205",317-998-3677,General Freight Delivery; Over the Road General Freight Delivery; Logistics; construction clean up,http://www.jlplogistics.com,Minority-Owned (general),Active,No
"Peer Exchange Network, LLC","N/A, Winchester, KY, N/A","859-948-5508, 859-744-6521","Leadership training, employee retention, and management consulting for women and minorities",https://www.soarlead.com,Women-Owned,Active,Yes
"Peer House, LLC","N/A, Lexington, KY, N/A",859-200-9034,"Tax preparation, data compilation, bookkeeping comparison benchmark, and CFO oversight",https://peerhousecpa.com/,Women-Owned,Active,Yes
"Performance Exteriors, Inc.","2400 Arnoldtown Woods Rd, Louisville, KY, 40214",502-935-5521,EIFIS and Stucco Comapny,http://www.performanceexterior.com,Women-Owned,Inactive,Yes
Phoenix Data Corporation,"5777 N. Post Road, Indianapolis, IN, 46216",317-354-1187,"Scanning / OCR / Indexing / Data Capture / Processing / Computer Facilities Management / Conversions / Engineering Technical Support / IT Technical Writers / Homeland Security / Airports / Port Station / Electronic Warfare Support Identify, Verify, Validate, Database Support Development / Implementa",http://www.phoenixdatacorporation.com,Women-Owned,Active,No
"Pier Group, LLC","N/A, Jasper, IN, N/A",812-650-7594,Procure and resell IT equipment to Higher Education and research institutions,https://www.piergroup.com,Women-Owned,Active,No
"Pillow Express Delivery, Inc. dba Pillow Express Logistics","N/A, Indianapolis, IN, N/A",317-415-4000,"Same day expedited courier services, cross dock services, and warehouse services",https://www.pillowlogistics.com/,Minority-Owned (general),Active,No
"PipeWorks Plus, Inc","N/A, Tullahoma, TN, N/A",913-455-7592,"Installation of Underground Utilities for Cities, Water Lines, Sewer Rehabilitation, Pipe Bursting",,Women-Owned,No Website,No
"Pointer Painting, LLC","N/A, Louisville, KY, N/A",502-795-4100,Painting and wall covering,,Minority-Owned (general),No Website,Yes
"Popham’s Trucking, LLC dba Pophams Trucking & Excavating","N/A, Brandenburg, KY, N/A",270-828-5520,"Material hauling (dirt, rock, sand, and asphalt), transport, and excavation",,Women-Owned,No Website,Yes
"Powers Engineering, Inc.","915 Main Street, Suite 306, Evansville, IN, 47708",812-774-0760,"Water resources engineering planning and design, sanitary collection system planning and design, water distribution system planning and design, stormwater collection system planning and design, wastewater treatment plant design, water treatment plant design, combined sewer overflow long term control",http://www.powersengineeringinc.com,Minority-Owned (general),Active,No
Presenta Plaque Corporation,"912 S Park Lane, Ste 101, Tempe, AZ, 85281",800-824-2930,Resale/wholesale of certificate Plaques,http://www.presentaplaque.com,Veteran-Owned,Active,No
"Prestige Tax Services, LLC","N/A, Louisville, KY, N/A",502-644-5457,"Tax preparation, business consulting, notary services, and copy, print, and fax services",https://www.prestigetaxpros.com,"Minority-Owned (general), Women-Owned",Inactive,Yes
Pride Business Enterprises,"1611 Spring Drive, Unit 4C, Louisville, KY, 40205",502-905-1529,Historical tours and local history.,https://this is a start up business and the site is not complete,LGBTQ+-Owned,Inactive,Yes
Prideful & Inclusive International Staffing,"560 N Tippecanoe Pl, Gary, IN, 46403",219-808-5295,Staffing,http://www.piiconsultancy.com,Minority-Owned (general),Inactive,No
Primera Engineers Ltd,"550 W. Jackson Blvd, Suite 600, Chicago, IL, 60661",312-242-6342,"Primera offers a wide range of professional services with a focus in three major areas of expertise: Buildings, Transportation and Utilities. We employ experts a variety of disciplines, including: mechanical, electrical, plumbing (M/E/P), structural, civil, and telecommunications engineering, as wel",http://www.primeraeng.com,Women-Owned,Active,No
Primetime Partners,"PO Box 34627, Louisville, KY, 40232",502-424-5659,"236118 Addition, alteration and renovation (i.e., construction), residential building",,Minority-Owned (general),No Website,Yes
"Professional Management Enterprises (PME), Inc.","N/A, Indianapolis, IN, N/A",317-541-0200,"Project management, Staff Augmentation, IT Services (including management and development, Cleaning and janitorial services, and Community Outreach and Engagement Services",https://www.pme-indy.com/,Minority-Owned (general),Active,No
"Prometheus Foundry, LLC dba Prometheus Art","N/A, Lexington, KY, N/A",502-592-3774,"Design & build metal sculpture, monuments, & architectural details; casting & fabrication services for metalwork & restoration of metal sculpture",https://www.prometheusart.com,Women-Owned,Active,Yes
Purchasing Connections Inc.,"133 Evergreen Road, Ste 210, Louisville, KY, 40243",502-253-5585,Wholesale Trade Agents and Brokers,http://www.purchasing-connections.com,Women-Owned,Inactive,Yes
"QMF STEEL, INC.","PO Box 460, Campbell, TX, 75422",(903) 455-3618 or (972) 974-8120 Fax: (903) 455-9282,"Related Services: 332312 – Specializing in Fabricated structural metal manufacturing; 332313 – Specializing in Plate work (e.g., bending, cutting, punching, shaping, welding) fabricated metal, manufacturing; 332322 – Specializing in Sheet metal work (except stampings) manufacturing; 332323 – Special",https://www.qmfsteel.com,Women-Owned,Inactive,No
"QUALITY CONTROL SERVICES, LLC","3214 St. Clair Avenue, N.E., Cleveland, OH, 44114",(216) 276-8539 or (216) 862-9264 Fax: (216) 862-9041,"Related Services: 236210 – Specializing in construction management, industrial building (except warehouses); 238210 – Specializing in traffic signal installation (inspection only); 541330 – Specializing in engineering consulting services (Kentucky Engineering license not required); 541350 – Speciali",https://www.qcsinspections.com,Minority-Owned (general),Active,No
"QUALITY FLOW, INC.","3691 Commercial Avenue, Northbrook, IL, 60062",(847) 291-7679 ext. 201 or (800) 227-5432,"Related Services/Concessionaire: 423440 - Specializing as regular dealer for Food service equipment (except refrigerated), commercial, merchant wholesalers; and 541690 - Specializing in “Water Quality” consulting services",https://www.qualityflow.com,Black-Owned,Active,No
"QUIGG ENGINEERING, INC.","2351 S. Dirksen Pkwy., Springfield, IL, 62703",(217) 670-0563 or (312) 235-6783,"Related Services: 541330 – Engineering Services; 541370 – Surveying and Mapping (except Geophysical) Services; and 
541620 – Environmental Consulting Services

Prequalified Consultant: construction project supervision, rural and urban roadway design, structure design spans under 500'",https://www.quiggengineering.com,Asian-Owned,Active,No
Quantum Care Solutions Inc.,"10488 Bluegrass Pkwy, Louisville, KY, 40299",502-267-1911,"Transportation, Medical Appointments, Non-Medical Concierge",https://www.ablecaretransport.com/,Women-Owned,Active,Yes
"Quantum Care Solutions, Inc.","N/A, Louisville, KY, N/A",502-267-1911,"Transportation for medical appointments, concierge services, stretchers - non-emergency",https://www.ablecaretransport.com/,Women-Owned,Active,Yes
"R Buckle Industries, LLC dba Taylor County Fence","N/A, Campbellsville, KY, N/A",270-789-1113,"Perimeter fencing - chain-link, barrier fence, vehicle gates, pedestrian gates, turnstiles, access, CCTS",,Women-Owned,No Website,Yes
R CATE PLUMBING AND MECH.CO. LLC,"7907 Hillside drive, Sellersburg, IN, 47172",812-613-0386,PLUMBING CONSTRUCTION SERVICES AND ASIAN PACIFIC AMERICAN MINORITY OWNED BUSINESS.,http://rcateplumbingandmechanical.com,Minority-Owned (general),Inactive,No
"R.I.W. Ornamental Metal, Inc.","N/A, Wilder, KY, N/A",859-655-9300,"Fabricate and Install ornamental and decorative rails, glass, cable, stainless steel, bronze and brass",https://www.riwornamental.com,Women-Owned,Active,Yes
"RASOR MARKETING COMMUNICATIONS, LLC","7844 Remington Road, Cincinnati, OH, 45242",(513) 793-1234 or (513) 910-8385,Related Services: 541613 – Specializing in Customer service management consulting services; Marketing consulting services; Marketing management consulting services; 541820 – Specializing in Public relation agencies; Public relations consulting services; Public relations services; and 541910 – Specia,https://www.gorasor.com,Women-Owned,Active,No
"RATH BUILDERS SUPPLY, INC.","PO Box 811, Defiance, OH, 45312",(419) 782-7284,"Material Supplier/BROKER: 423320 – Specializing in supplying Crushed stone, Gravel, and Sand; 423390 - Specializing in supplying Septic tanks and systems (except concrete), Storage tanks/chambers (except concrete), Risers/lids and related items, Parking blocks, ADA wheelchair ramp mats, Silt fence, ",https://www.rathbuilderssupply.com,"Native American-Owned, Women-Owned",Active,No
"RCDC TRANSPORT, INC. d/b/a DFC TRANSPORT","1331 Franklin Avenue, Cincinnati, OH, 45237",(513) 550-8078,"Related Services/Concessionaire: 484110 – General Freight Trucking, Local; and 484121 – General Freight Trucking, Long-Distance, Truckload",https://N/A,Black-Owned,Inactive,No
"RED'S CORNER, LLC","PO Box 983, Louisville, KY, 40201",(323) 864-3289 or (502) 587-7337,"Related Services: 722310 – Specializing in Food service contractors, concession operators (e.g. convention facilities, entertainment facilities, sporting facilities)",https://www.redscomfortfood.com,Black-Owned,Inactive,Yes
"REGIONAL MOBILITY GROUP, LLC","1428 Forest Lane, St. Johns, FL, 32259",(904) 813-3283,"Consultant: 485111 - Specializing in Commuter transit systems, mixed mode (e.g., bus, commuter rail, subway combination); Local transit systems, mixed mode (e.g., bus, commuter rail, subway combinations); Mixed mode transit systems (e.g., bus, commuter rail, subway combinations); Suburban transit sy",https://www.regionalmobilitygroup.com,Women-Owned,Active,No
"RELY SUPPLY, LLC","237 Baxter Avenue, Cincinnati, OH, 45220",(513) 376-6703 or (513) 207-2960,"Related Services: BROKER - 425120 - Specifically agents and brokers, durable goods, wholesale trade; and Agents and brokers, nondurable goods, wholesale trade",https://www.RelySupply.com,Black-Owned,Active,No
"RHA, LLC","6677 W. Thunderbird Road, Suite K183, Glendale, AZ, 85306",(623) 266-3943 or (800) 480-1401 Fax: (623) 266-3611,"Related Services: 541330 – Specializing in value engineering; 541611 – Specializing in business management consulting services; reorganizational consulting services; and site selection consulting services; and 541614 – Specializing in efficiency management (i.e., efficiency expert) consulting servic",https://www.rhpartnering.com,Women-Owned,Inactive,No
"RIVER STREET GROUP, LLC","2 E. Bryan Street, Suite 600 A, Savannah, GA, 31401",(770) 639-0331,"Related Services: 541611 – Specializing in transportation planning, and project and program management consulting services",https://N/A,Women-Owned,Inactive,No
"RL CONTROLS, LLC","2G Gill Street, Woburn, MA, 01801-1721",(781) 932-3349 or (617) 771-6167 Fax: (781) 932-3359,"Related Services: 237130 - Specializing in Construction management, power and communication transmission line construction; Fiber optic cable transmission line construction; and Radio transmitting tower construction; 238210 – Specializing in Alarm system (e.g. fire, burglar), electric, installation ",https://www.RLControls.com,Women-Owned,Active,No
RLF General Contractors LLC,"9633 Lamborne Blvd Apt 2, Louisville, KY, 40272",502-416-6916,Computer programing,http://rflgeneralcontractorsllc.com,Disability-Owned,Inactive,Yes
"ROC EQUIPMENT, LLC","PO Box 3143, Salt Lake City, UT, 84110",(801) 214-6126 Fax: (801) 214-6144,"Material Supplier/BROKER: 331210 – Specializing in Pipe (e.g., heavy riveted, lock joint, seamless, welded) made from purchased iron or steel; Tube (e.g., heavy riveted, lock joint, seamless, welded) made from purchased iron or steel; and Well casings (e.g., heavy riveted, lock joint, welded, wrough",https://www.rocequipment.com,Women-Owned,Active,No
"ROCKLAND PLANNING, INC.","6754 Jonestown Road, Harrisburg, PA, 17112-3328",(610) 780-7707,"Related Services: 541611 –Specializing in Planning, Policy, Financial and economic development, and Project development and management services predominantly to public agencies and private development firms for transportation and community redevelopment projects",https://www.rocklandplanning.com,"Latino-Owned, Women-Owned",Active,No
"ROD-TECHS, INC.","PO Box 101, Milford, OH, 45150",(513) 522-1111 Fax: (513) 522-1234,"Related Services: 238120 - Specializing in Concrete reinforcement placement; Curtain wall, precast concrete, installation; Placing and tying reinforcing rod at a construction site; Prestressed concrete beam, slab or other component installation; Rebar contractors; Reinforcing rod, bar, mesh and cage",https://www.rodtechs.org,Black-Owned,Active,No
"ROI Marketing Company, Inc.","5740 Decatur Blvd, Indianapolis, IN, 46241",317-644-0797,"ROI has been operating in the marketing space since 2004 and the PPE and safety space since 2009. We address the areas; of marketing and safety by strategically aligning seven service zones identified as Branded Apparel, Printing, Promotional; Products, PPE, Infrared-thermal Technology, COVID tests ",http://www.roippe.com,Minority-Owned (general),Active,No
"ROSALES + PARTNERS, INC.","10 Derne Street, Boston, MA, 2114",(617) 247-7499 or (617) 501-6202 Fax: (617) 247-7139,Related Services: 541310 - Specializing in architectural (except landscape) consultants' offices and architectural (except landscape) design services,https://www.rosalespartners.com,Latino-Owned,Active,No
"ROYAL CRANE SERVICE, INC.","PO Box 1858, Bridgeview, IL, 60455",(708) 974-0832 Fax: (708) 974-0865,Related Services: 238990 - Specializing in crane rental with operator and 532412 - Specializing in construction machinery and equipment rental or leasing without operator; crane rental or leasing without operator; and heavy construction equipment rental without operator,https://www.royalcrane.us,Latino-Owned,Active,No
"RUBIO ENTERPRISES, LLC","9991 Wyecliff Place, Highlands Ranch, CO, 80126",(303) 908-2083,"Concessionaire/Material Supplier: 339910 - Specializing in Jewelry, precious metal, manufacturing; and 423940 - Specializing in Jewelry merchant wholesalers",https://www.RenataRubio.com,"Latino-Owned, Women-Owned",Active,No
"Rachel  D. Worley, Architects PSC dba Three Dot Design, LLC","N/A, Louisville, KY, N/A",502-639-7519,"Drafting, architectural design, consulting",https://www.three-dot-design.com,Women-Owned,Active,Yes
"Radar Plumbing, Inc.","N/A, London, KY, N/A",606-312-5944,Plumbing construction contractor,https://www.radarplumbinginc.com/,Minority-Owned (general),Active,Yes
"Randi Frank Consulting, LLC","N/A, Louisville, KY, N/A",203-213-3722,"HR Consultant - executive searches, recruitment personnel policies, job descriptions, risk management, compensation studies, etc.",https://www.randifrank.com,Women-Owned,Active,Yes
"Randi Frank Consulting, LLC","7700 Hoover Way, Louisville, KY, 40219",203-213-3722,"Randi Frank Consulting, LLC is a Management & Human Resources Consulting Firm serving government agencies and small businesses. We provide executive searches, recruitment services, development of personnel policies, development of job descriptions, sexual harassment prevention training, risk managem",http://www.randifrank.com,Women-Owned,Active,Yes
"Rangaswamy & Associates, Inc","539 W Market Street, Suite 200, Louisville, KY, 40202",502-589-2212,"Engineering-Consulting Structural Engineering, Construction Inspection, CAD;",http://www.raiengineering.com,Women-Owned,Active,Yes
"Re:land Group, LLC","10509 Jimson Pool Street, Prospect, KY, 40059",502-518-4653,"Urban Planning , Design, and Development Group.",http://www.reland.group,Minority-Owned (general),Active,Yes
ReMedi Health Solutions LLC,"N/A, Houston, TX, N/A",713- 264-2414,"Healthcare consulting, offering strategic, clinical, and management services for hospitals and physicians, specifically training and support for hospital admissions when they switch to electronic records systems",http://www.remedihs.com/,Minority-Owned (general),Active,No
"Realty World Adams & Associates, Inc.","N/A, Berea, KY, N/A",859-314-7878,Offices of real estate agents & brokers; list & sell real estate in Central Kentucky,https://www.realtyworldadams.com,Women-Owned,Active,Yes
"Realty World TNT, Inc.","N/A, Georgetown, KY, N/A",,Residential real estate sales,https://www.realtyworldtnt.com/,Women-Owned,Active,Yes
Rebeca Cleaning Services,"N/A, Louisville, KY, N/A",502-544-4330,Commercial cleaning and janitorial services,,"Minority-Owned (general), Women-Owned",No Website,Yes
"Receiver Services, LLC","N/A, Burlington, KY, N/A",859-468-3652,"Administrative services, property management",,Women-Owned,No Website,Yes
"Reclaim Company, LLC","N/A, Fairmont, WV, N/A",304-366-7076,"Site preparation, utilities, demolition, asbestos & lead abatement & testing, asset recovery & recycling, environmental remediation, excavation",https://www.reclaimcowv.com,Minority-Owned (general),Active,No
"Reconcile Consulting, LLC","3818 Carver street, New Albany, IN, 47150",502-632-4118,Consulting Services,"http://reconcile consulting, llc",Minority-Owned (general),Inactive,No
Red Arrow Corporation,"N/A, Westport, KY, N/A",502-208-0864,"Property maintenance, landscaping, lawn care, snow removal, and rough cut mowing",http://www.redarrowcorp.net/,Women-Owned,Active,Yes
"Redden Trucking, Inc","N/A, Floyds Knobs, IN, N/A",502-262-7229,"Hauling aggregate, asphalt & dirt",,Women-Owned,No Website,No
Redwood Enterprises L.L.C,"627 Southwestern Pkwy, Louisville, KY, 40211",502-819-1589,"General construction trades, specializing in concrete-related work",,Minority-Owned (general),No Website,Yes
"Reflective Learning, LLC","N/A, Falls of Rough, KY, N/A",270-617-0958,"Educational consulting services, authoring educational resources, speaking on educational topics",https://www.reflecttolearn.com,Women-Owned,Active,Yes
"Renascent, Inc.","935 West Troy Avenue, Indianapolis, IN, 46225",317-783-1500,Selective and structural heavy demolition; roll off construction waste business.,http://www.renascentinc.com,Women-Owned,Active,No
"Renegade Division, LLC","N/A, Russellville, KY, N/A",270-791-1141,Performance products,https://www.renegadefacefuel.com,Minority-Owned (general),Inactive,Yes
"Replica Screenprinting, LLC","N/A, Cave City, KY, N/A",270-773-4386,"Screen-printing, promotional Items, graphic design",https://www.replicascreenprints.com,Women-Owned,Inactive,Yes
