Business Name,Address,Phone,Services / Products,Website,Minority Type,Status,Kentucky Based
"KECH, Inc.","N/A, Williamsburg, KY, N/A",606-703-0347,IT Services and contact center services,https://www.kechco.com,Women-Owned,Active,Yes
"KELEUSMATIC TECHNOLOGIES, INC.","8362 Pines Blvd., #131, Pembroke Pines, FL, 33024",(954) 543-5701 Fax: (954) 543-5711,"Related Services: 238210  – Specializing in Audio equipment installation (except automotive) contractors, Communication equipment installation, Computer and network cable installation, Public address system installation, Telecommunications equipment, and wiring (except transmission line) installatio",https://www.keleusmatic.com,Asian-Owned,Active,No
"KELLY MCNUTT CONSULTING, LLC","1811 SE 173rd Avenue, Vancouver, WA, 98683",(360) 772-0954,"Related Services: 237310 – Specializing in construction management; 237990 – Specializing in construction management, marine structure; 541330 – Specializing in Value Engineering for Construction engineering services - cost estimating; scheduling and project constructability means and methods;
54161",https://www.KMCcostandrisk.com,Women-Owned,Active,No
"KEN WEEDEN & ASSOCIATES, INC.","PO Box 3113, Wilmington, NC, 28406",(910) 762-6297 or (919) 871-5815 Fax: (910) 762-5963,"Consultant: 541330 – Specializing in engineering management services, which includes, onsite monitoring and tracking, 
compliance, report development, project outreach and good faith effort reviews on engineering/construction projects; 
541611 – Administrative Management and General Management Consu",https://www.kwaplanning.com,Black-Owned,Active,No
"KENDALL MARKETING SOLUTIONS GROUP, LLC","1843 Bogard Lane, Mt. Washington, KY, 40047",(502) 417-2237,"BROKER: 322230 – Specializing in Cards, die-cut office supply (e.g., index, library, time recording), made from purchased paper or paperboard; Die-cut paper products for office use made from purchased paper or paperboard; Envelopes (i.e., mailing, stationery) made from any material; Letters, die-cut",https://www.kendallmarketing.net,Women-Owned,Inactive,Yes
"KENTUCKIANA OFF-DUTY POLICE & SURVEILLANCE, INC.","PO Box 75, Bardstown, KY, 40004",(877) 880-KOPS (5677)  Fax: (877) 880-5677,"Related Services: 561612 – Specializing in Body guard services; Guard services; Patrol services, security; Personal protection services (except security systems services); Property protection services (except armored car, security systems); Protection services (except armored car, security systems),",https://www.kopsinc.com,Women-Owned,Active,Yes
"KERSEY & KERSEY, INC.","839 East Gray Street, Louisville, KY, 40204",(502) 583-0094 or (502) 767-4844 Fax: (502) 585-2728,Related Services: 541310 – Specializing in Architects' (except landscape) offices; Architects' (except landscape) private practices; Architectural (except landscape) consultants' offices; Architectural (except landscape) design services; Architectural (except landscape) services; Building architectu,https://www.kerseyandkersey.com,Women-Owned,Active,Yes
"KLB PROPERTY MAINTENANCE, INC.","713 S. 26th Street, Louisville, KY, 40211",(502) 776-5606 Fax: (502) 776-5607,"Related Services: 238160 – Specializing in Asphalt roof shingle installation; Roll roofing installation; Roofing contractors; Shake and shingle, roof, installation; and Steep slope roofing installation; and 561730 – Specializing in Fertilizing lawns; Garden maintenance services; Hydro seeding servic",https://N/A,Black-Owned,Inactive,Yes
"KLP COMMERCIAL, LLC","18013 Vorwerk Road, Manor, TX, 78653",(512) 294-9078,"Material Supplier: 324121 –  Specializing in Asphalt paving mixtures made from purchased asphaltic materials, Asphalt road compounds made from purchased asphaltic materials, and Tar and asphalt paving mixtures made from purchased asphaltic materials; 327310  – Specializing in Cement (e.g., hydraulic",https://www.KLPCommercial.com,"Native American-Owned, Women-Owned",Active,No
"KNOWLEDGE ARCHITECTS, LLC","3101 Cobb Parkway, #124, Atlanta, GA, 30339",(678) 218-7605,"Related Services: 541511 – Specializing in Applications software programming services, custom computer; Computer program or software development, custom; Computer software analysis and design services, custom; Software analysis and design services, custom computer; Software programming services, cus",https://www.k-archllc.com,"Black-Owned, Women-Owned",Active,No
"KOFI CONSULTING, INC. d/b/a MARTIN CONSTRUCTION COMPANY","1207 Durrett Lane, Louisville, KY, 40213-2021",(502) 375-3701 Fax: (502) 375-3703,"Related Services: 236220 - Specializing in the Addition, alteration and renovation of commercial and institutional buildings; commercial warehouses; for-sale builders - commercial and institutional buildings; for-sale builders - commercial warehouses; for-sale builders - hotels and motels; for-sale ",https://N/A,Black-Owned,Inactive,Yes
"KOLAR DESIGN, INC.","807 Broadway Street, 5th Floor, Cincinnati, OH, 45202",(513) 241-4884 Fax: (513) 241-2240,Related Services: 541430 - Graphic Design Services,https://www.kolardesign.net,Women-Owned,Active,No
"KOPPEL FABRICATION, INC.","10262 Hwy. 127, Sweet Springs, MO, 65351",(660) 335-4601 or (816) 564-2927 Fax: (660) 335-0114,"Related Services: 237310 – Specializing in guardrail construction; and 332323 – Specializing in manufacturing balcony railings, metal; bannisters, metal; chain ladders, metal; fences and gates (except wire), metal; flooring, open steel (i.e., grating); gates, holding, sheet metal; gates, metal (exce",https://www.koppelfab.com,Women-Owned,Active,No
"KRISTINE FALLON ASSOCIATES, INC.","16247 Wausau Avenue, South Holland, IL, 60473",(331) 444-2211; (312) 360-9600; (312) 672-9176; Cell: (312) 672-9195 or (708) 769-2898 Fax: (412) 360-9601,"Related Services: 518210 - Specializing in services for Application hosting, Automated data processing, Computer data storage, Computer input preparation, Computer time leasing, Computer time rental, Computer time sharing, Data capture imaging, Data entry, Data processing computer, Data processing (",https://www.kfa-inc.com,Black-Owned,Active,No
"Kali Systems, LLC dba C. Garcia Associates, LLP","N/A, Indianapolis, IN, N/A",317-343-2144,"Performs comprehensive construction management services, business development strategies & project fund development & financing strategies",https://www.cgarciaassociates.com,Minority-Owned (general),Active,No
Kendall Marketing Solutions Group LLC,"1843 BOGARD LANE, Mt Washington, KY, 40047",502-417-2237,"Advertising materials, commercial printing, promotional products,",http://www.kendallmarketing.net,Women-Owned,Active,Yes
"Kentuckiana Off-duty Police & Surveillance, Inc. (KOPS)","N/A, Bardstown, KY, N/A",877-880-5677,Security & traffic control using off-duty law enforcement officers,https://kopsinc.com,"Minority-Owned (general), Women-Owned",Active,Yes
"Kentuckiana Sheet Metal, Inc.","N/A, Louisville, KY, N/A",502-635-7689,Fabricate sheet metal duct work and install on job site. Install commercial HVAC equipment,,Minority-Owned (general),No Website,Yes
"Kentuckiana Tire Recycling, LLC","2305 Ralph Ave, Louisville, KY, 40216",502-822-3809,"Tire collection services to companies that generate waste/scrap tires: tire dealers, auto repair shops, auto dealerships, auto/truck rental agencies, taxi companies, trucking companies, & individuals.; 1. Storage area pickup – We send a box truck to remove tires from a storage area; pickups can be w",http://www.kentuckianatirerecycling.com,Women-Owned,Active,Yes
"Kentucky Cut Stone, LLC","N/A, Lancaster, KY, N/A",606-669-1174,"Non-coal surface mine, producer of natural limestone building stone",,Women-Owned,No Website,Yes
"Kentucky Cut Stone,LLC","102 Bedrock Drive, Lancaster, KY, 40444",606-669-1174,Permitted Limestone Quarry providing building veneer and natural landscaping stone.,,Women-Owned,No Website,Yes
"Kentucky Tree Care, Inc.","N/A, Somerset, KY, N/A",606-383-3196,"Tree trimming, removal, stump grinding, some grading and land clearing",,Women-Owned,No Website,Yes
"Kentucky Used Tires, LLC dba Kentuckiana Tire Recycling","N/A, Louisville, KY, N/A",502-822-3809,"Tire removal services, tire collection, and tire shredding",https://www.kyusedtires.com,Women-Owned,Active,Yes
Kestrel Company,"3420 Collins Ln, Louisville, KY, 40245",502-241-6004,"Warehouse, freighting",http://www.eaglesmp.com,Women-Owned,Active,Yes
Kimberly Carter Health and Beauty,"5324 Bardstown Rd, Louisville, KY, 40291",502-510-7330,"Personal training, group fitness, and meal coaching services.",https://www.kdchealthconsultants.com/,Minority-Owned (general),Inactive,Yes
Kimberly Carter Health and Beauty LLC dba KDC Health Consultants,"N/A, Louisville, KY, N/A",502-510-7330,Group and one-on-one training services and waist trainers and body shaper products,https://www.kdchealthconsultants.com/,"Minority-Owned (general), Women-Owned",Inactive,Yes
KinMar LLC,"N/A, Winchester, KY, N/A",859-595-6336,"Dielectric testing, recertification of electrical safety goods, retail for electrical safety supplies & general safety supplies",https://www.Kinmarllc.com,Women-Owned,Active,Yes
"Klein Printing, Inc.","N/A, Covington, KY, N/A",859-341-4774,"Printing, graphic design, promotional items & uniforms",https://www.kleinprinting.com,Women-Owned,Inactive,Yes
"Kriss Lowry & Associates, Inc.","N/A, Corinth, KY, N/A",502-857-2800,"Planning consulting services; land use planning, grant writing, administration of housing redevelopment projects for cities & counties",https://www.krisslowry.com,Women-Owned,Active,Yes
"L & C MANAGEMENT, INC.","163 E. Main Street, Suite 404, Lexington, KY, 40507-1738",(859) 258-0322 or (859) 621-2482 Fax: (859) 264-0974,"Related Services: 236115 - Specializing in Condominium, single-family, construction general contractors, Construction management, single family building, Custom builders (except for-sale), single family home, Duplex (i.e., side-by-side) construction general contractors, Home builders (except for-sal",https://N/A,Black-Owned,Inactive,Yes
"L & D Mail Masters, Inc.","110 Security Parkway, New Albany, IN, 47150",812-981-7161,Direct Mail Consulting,http://www.ldmailmasters.com,Women-Owned,Active,No
"L Seuguras Logistics, LLC","N/A, Louisville, KY, N/A",305-898-0834,Dump trucking,,Minority-Owned (general),No Website,Yes
L Watson Trucking LLC,"211 North Beckley Station Rd, Louisville, KY, 40245",502-727-1713,"Tri Axle Dump Truck business. Dumpster, Demolition;",,Minority-Owned (general),No Website,Yes
"L. L. BROWN, LLC","PO Box 680, Scottsburg, IN, 47170",(812) 752-8787 or (502) 773-3086 Fax: (812) 752-5494,"Related Services: 237310 - Specializing in abutment construction, bridge construction, bridge approach and bridge decking construction, culverts, highway, road and street construction, curbs and street gutters, highway, road and street construction, highway and overpass construction, repair, highway",https://N/A,Women-Owned,Inactive,No
"L. WATSON TRUCKING, LLC","211 North Beckley Station Road, Louisville, KY, 40245",(502) 727-1713 or (502) 387-9211,"Related Services: 238910 - Specializing in Building demolition, Bulldozer rental with operator, Concrete breaking and cutting for demolition, Demolition, building and structure, Dirt moving for construction, Excavating, earthmoving, or land clearing contractors, Foundation digging (i.e., excavation)",https://N/A,Black-Owned,Inactive,Yes
"L.A. Promotions, Inc.","N/A, Louisville, KY, N/A",502-244-2525,Providing promotional products to our clients and embroidery services,https://www.lapromotions.com/,Women-Owned,Active,Yes
"LANDRY CONSULTING, LLC","3801 Edgewood Drive, Vancouver, WA, 98661",(206) 714-7663 or (206) 420-3361,Related Services: 541614 - Specializing in Transportation management consulting services; and 541690 - Specializing in Safety consulting services,https://www.landryconsultants.com,Women-Owned,Active,No
"LANDSCAPER'S CORNER, INC.","1305 Old Frankfort Pike, Lexington, KY, 40504",(859) 225-9433 Fax: (859) 255-1053,"Material Supplier:  423320 – Specializing in gravel, construction; lime (except agricultural); sand (except industrial), slate and slate products, and stone, building or crushed; 423710 – Specializing in hand tools (except motor vehicle mechanics’, machinists’ precision) and tools, hand (except moto",https://N/A,Women-Owned,Inactive,Yes
"LANDVIEW SERVICES, LLC","4137 Trenton Road, Hamilton, OH, 45011",(513) 737-8055 or (513) 673-5062 Fax: (513) 737-5467,"Related Services: 237310 - Specializing in miscellaneous concrete; 237990 - Specializing in drainage and earth retaining structures; 238910 - Specializing in building removal, incidental grading, roadway excavation and embankment construction, and structure removal; 238990 - Specializing in temporar",https://www.landview-services.com,Women-Owned,Active,No
"LC Hauling, LLC","5800 Poplar Level Rd, Ste N, Louisville, KY, 40228",502-386-1376,Transportation of heavy equipment and construction supplies. Transportation of other various items.,,Minority-Owned (general),No Website,Yes
LE FAMILLE,"4407 Cosby Court, Louisville, KY, 40218-3044",(502) 473-1776 or (502) 435-9223 Fax: (502) 473-0643,"Related Services: 561730 - Specializing in Seeding lawns and Sod laying services

BROKER: 423220 – Specializing in Mailboxes; 423310 – Specializing in Drywall boards and Plywood; 423320 – Specializing in Drywall supplies; 423330 – Specializing in Sheet metal roofing materials; 423390 – Specializing ",https://N/A,Black-Owned,Inactive,Yes
"LEAN Business Solutions, LLC","N/A, Georgetown, KY, N/A",502-863-2933,"Consultant for efficiency improvement opportunities. Coaching, training and presentations",,Minority-Owned (general),No Website,Yes
"LECGI, INC.","13113 East Point Park Blvd., Suite D, Louisville, KY, 40223",(502) 425-1647 Fax: (502) 241-4103,"Related Services: 541330 - Specifically construction engineering services, consulting engineers’ private practices, engineering consulting services, engineering design services, and engineering services",https://www.lecgi.us,Minority-Owned (general),Active,Yes
"LECGI, Inc.","13113 Eastpoint Park Blvd, Suite D, Louisville, KY, 40223",502-425-1647,"Provide structural engineering consulting service, including commercial building and industrial facility structural design",http://www.lecgi.us,Minority-Owned (general),Active,Yes
"LEDAMARK, Inc.","N/A, Stanton, KY, N/A",402-250-9033,"Installation of equipment - pallet rods, security cages and storage containers, pumps, motors, exhaust fans, flag poles, key/cone locks",,Women-Owned,No Website,Yes
"LEGACY GROUP ALPHA, LLC","7414 Hidden Creek Drive, Charlotte, NC, 28214",(980) 346-3360,"BROKER: 425120 - Specializing in electric charging stations, solar panels and electric vehicles (cars, buses)",https://www.tlg-alpha.tech,Black-Owned,Inactive,No
"LEGEND PAINTING, INC.","403 Tenney Avenue, Campbell, OH, 44405",(330) 953-3264 Fax: (330) 953-1035,"Related Services: 238320 – Painting and Wall Covering Contractors – Specializing in Coating Structural Steel; and 238390 – Other Building Finishing Contractors – Specializing in Concrete Sealing

Prequalified: Bridge Painting - Level B",https://www.legend@legendpainting.net,Women-Owned,Active,No
"LESLIE SAUNDERS INSURANCE AGENCY, INC.","4584 North Rancho Drive, Las Vegas, NV, 89130",(702) 646-2082 Fax: (702) 648-6591,"Concessionaire: 524210 – Specializing in Insurance Agencies and Insurance Brokerages; 524298 – Specializing in Insurance actuarial services, Insurance coverage consulting services, Insurance loss prevention services, Insurance rate making services, and Insurance reporting services; 541612 – Speciali",https://www.lesliesaunders.com,Black-Owned,Active,No
"LESTAR MINERAL DEVELOPMENT, INC.","868 Floyd Drive, Suite 100, Lexington, KY, 40505",(859) 687-9250 or (859) 608-9926 Fax: (859) 253-1036,"Material Supplier/BROKER: 423510 – Metal Service Centers and Other Metal Merchant Wholesalers; 424720 - Specializing as a material supplier of oil, petroleum, merchant wholesalers (except bulk stations, terminals); and petroleum and petroleum products merchant wholesalers (except bulk stations, term",https://N/A,Black-Owned,Inactive,Yes
"LINDA F. SUMPTER, CPA, PSC","910 Blackberry Road, Inez, KY, 41224",(606) 298-4189 Fax (606) 298-5982,"Related Services: 541211 - Specializing as certified public for Accountants’ (i.e., CPAs) offices, Accountants’ (i.e., CPAs) private practices, Accounting (i.e., CPAs) services, Certified accountants’ offices, Certified public accountants’ offices, CPAs’ (certified public accountants) offices, Publi",https://www.lindasumptercpa.com,Women-Owned,Inactive,Yes
"LJH Infinity Realtors, Inc.","1608 W. Broadway, Suite 102, Louisville, KY, 40203",502-968-9088,Real estate sales and services.;,http://ljhinfinityrealtors.com,Minority-Owned (general),Active,Yes
LMCC SPECIALTY CONTRACTORS d/b/a MIMS CONSTRUCTION COMPANY,"PO Box 681554, Orlando, FL, 32868",(407) 298-6936 Fax: (407) 290-1217,"Related Services: 236220 - Specializing in construction management; 238110 - Specializing in Concrete finishing, Concrete pouring, Concrete pumping (i.e., placement), Footing and foundation concrete contractors, Foundation contractors, and Retaining wall construction; 238140 - Specializing in Concre",https://www.mimsconstruction.com,"Black-Owned, Women-Owned",Active,No
"LMH Accounting & Consulting, LLC","N/A, Louisville, KY, N/A",502-996-7150,"Accounting services, auditing, payroll, taxation, financial statement preparation, bookkeeping, fraud investigation, forensic accounting",https://www.LMHAccounting.com,"Minority-Owned (general), Women-Owned",Active,Yes
"LONGHOUSE INVENTORY SOLUTIONS, LLC","PO Box 1212 (M), Claremore, OK, 74018",(918) 342-3127 Fax: (918) 342-2423,"Concessionaire: 332439 – Specializing in Containers, light gauge metal (except cans), manufacturing; 423990 – Specializing as a Regular Dealer of general merchandise, durable goods, merchant wholesalers; safety deposit boxes merchant wholesalers; safety device (e.g., eye shields, face shields) merch",https://www.lisstore.com,"Native American-Owned, Women-Owned",Inactive,No
"LOWERS WELDING & FABRICATION, INC.","PO Box 2985, Santa Fe Springs, CA, 90670",(562) 946-4521 Fax: (562) 903-0116,"Related Services: 238120 - Specializing in Erecting structural steel; Iron work, structural, contractors; Reinforcing steel contractors; Structural steel erecting or iron work contractors; 238990 - Specializing in Patio construction; Shoring, construction; 332312 - Specializing in Concrete reinforci",https://www.lowerswelding.com,Women-Owned,Active,No
"LUCID LOGISTICS, LLC","10 Clusters Court, Suite B, Columbia, SC, 29210",(803) 422-1519 or (803) 261-3754,Concessionaire: 425120 - Specializing as Petroleum brokers,https://www.lucid2020.com,Black-Owned,Active,No
LUMENOR CONSULTING GROUP,"11475 Great Oaks Way, Suite 240, Alpharetta, GA, 30022",(470) 747-7946 or (404) 918-9078 or (334) 207-0049  Fax: (404) 348-4829,Related Services: 541360 – Specializing in Aerial geophysical surveying services; and Geophysical Mapping Services; 541370 – Surveying and Mapping (except Geophysical) Services – Specializing in Aerial surveying (except geophysical) services; Cadastral surveying services; Geographic information syst,https://www.lumenorconsulting.com,Women-Owned,Inactive,No
LVR International,"1950 E. Greyhound Pass 18 #123, Carmel, IN, 46033",888-471-4777,"Parking Strategic Planning and Design Consulting; Management- Operations-Audit Consulting; Park and Rides- Shuttle Buses Planning and Audits; Transportation and Land-Use Consulting, Public Outreach and Marketing; Policies and Procedures Development; Staff Training;",http://www.lvrintl.com,Minority-Owned (general),Active,No
Laekin Group Inc.,"139 Betty Lou Street, Pleasureville, KY, 40057",502-417-3046,Provide construction Materials & Services.,http://laekin-group-llc.business.site,Minority-Owned (general),Inactive,Yes
"Landmark Construction, LLC","N/A, Hazard, KY, N/A",606-216-1485,"Excavation, Dirt Hauling, Walls/Bridges, Concrete",https://www.landmarkconstruct.com,Women-Owned,Active,Yes
"Landscaper's Corner, Inc.","N/A, Lexington, KY, N/A",859-225-9433,"Landscape supply company include mulches, decorative gravels, soil amendments, grass seed, vegetable seed, straw, pine straw, tools, and natural stone",,Women-Owned,No Website,Yes
"LeGrande Technical and Social Services, LLC","7579 Venture Drive, Alexandria, VA, 22315",703-344-1819,90103 Communications Consultant; 90902 Information Systems; 90903 Telecommunications; 90148 INFORMATION TECHNOLOGY RECRUITING (MBEC),http://thedigitaldecision.com,Minority-Owned (general),Active,No
"Leadership Bridges, LLC","N/A, Erlanger, KY, N/A",859-582-5603,"Business consulting for government and nonprofit organizations in strategic planning, governance, leadership coaching and development, teambuilding, organizational design, and strategic alliances",https://www.leadershipbridges.com,Women-Owned,Active,Yes
"Lee Computers, LLC","5625 N German Church Rd, Indianapolis, IN, 46235",317-829-0457,"Lee Infinite Solutions is a technology company that specializes Network cabling, Security Cameras, Access Control, Audio and VoIP Phone Systems",http://www.leecomp.net,Minority-Owned (general),Active,No
"Legacy Title Company, LLC","1301 Clear Springs Trace, Suite 200, Louisville, KY, 40223",502-400-5550,"Prepare and Perform Real Estate Title, Closing & Escrow Services, and Provide Legal Services",http://www.legacytitlecompany.com,Women-Owned,Active,Yes
"Lifestone Dynamic, LLC","8503 Bayou Way, Louisville, KY, 40202",502-797-3022,"General, Remodeling, Wall covering;",http://www.lifestonedynamic.com,Minority-Owned (general),Inactive,Yes
Lift Up Tumbling and Nutrition,"3810 N. Kercheval Drive, Indianapolis, IN, 46226",317-801-4596,"Fitness instruction, personal training, and nutrition",https://www.golutan.com/,Minority-Owned (general),Active,No
Lightly LLC,"12310 Brightfield Drive, Louisville, KY, 40243",502-644-7084,Electrical Contractor,,Minority-Owned (general),No Website,Yes
"Lincoln Manufacturing USA, LLC","N/A, Stanford, KY, N/A",606-365-3016,"Metal stamping facility with the capability to manufacture a wide range of parts from simple stampings to close tolerance critical parts; as well as, projection welding, grinding & lathe operations; our largest volume types of parts supplies to our different customers are transmission parts; tier 2 ",https://www.lincolnmfg.com,Minority-Owned (general),Active,Yes
"Linda F. Sumpter, CPA, PSC","N/A, Inez, KY, N/A",606-298-4189,"Full accounting, bookkeeping and payroll services, tax preparation, budget preparation, and billing services",,Women-Owned,No Website,Yes
"Little Creek Construction, Inc.","N/A, Greenup, KY, N/A",606-473-6296,"Installation of rural water lines by trenching and additional bores, and underground utilities",,Women-Owned,No Website,Yes
Logsdon Endeavors LLC,"1948 Gardiner Lane, Louisville, KY, 40205",502-594-5109,Sign Language Interpreting and Referral Service,http://www.aslinterpretingservices.com,Women-Owned,Active,Yes
"Longevity Power Wash, LLC","N/A, Louisville, KY, N/A",502-276-6309,"Truck washing, residential and commercial power washing, fuel station and restaurant cleaning, graffiti removal, waste water recovery systems",https://www.longevitypowerwash.com,Minority-Owned (general),Active,Yes
Lorie Gutierrez,"3432 Alvin Drive, Jeffersonville, IN, 47130",502-356-4166,"Interpretation, Translation, Transcription",,Women-Owned,No Website,No
Louisville Outdoor Turf Products LLC,"13005 Middletown Industrial Boulevard, Suite E, Louisville, KY, 40223",502-742-0114,"We sell outdoor power equipment, parts, accessories and service including snow plows and salt spreaders.",http://www.louisvilleotp.com,Women-Owned,Active,Yes
"Louisville Outdoor Turf Products, LLC","N/A, Louisville, KY, N/A",502-742-0114,"Outdoor power equipment, parts, accessories and service, including snow plows and salt spreaders",https://www.louisvilleotp.com,Women-Owned,Active,Yes
"Loveday Consulting, LLC","N/A, Lexington, KY, N/A",859-248-5434,Grant writing and environmental review completions for federally funded projects,,Women-Owned,No Website,Yes
"M & M MANUFACTURING, INC.","709 Sportsman Lake Road, Franklin, KY, 42134",(270) 586-8208 Fax: (270) 586-6424,"Related Services: 332312 - Specializing in fabricated structural metal manufacturing and structural steel, fabricated, manufacturing; 332322 - Specializing in sheet metal work (except stampings), manufacturing and troughs, elevator, sheet metal (except stampings), manufacturing; and 332323 - Special",https://www.m-mmanufacturing.com,Women-Owned,Active,Yes
"M&M Finishing, LLC","N/A, Walton, KY, N/A",859-485-1100,Application of metal & ceramic coating to industrial components,https://www.mandmfinishing.com,Women-Owned,Active,Yes
"MACKEY GROUP, LLC d/b/a WISER STRATEGIES","108 Esplanade, Suite 240, Lexington, KY, 40507",(859) 227-8850 or (859) 269-0123,"Related Services: 512110 – Specializing in commercials, television, production; film studios producing films; Instructional video production; motion picture and video production; motion picture production; television commercial production; video production; video production and distribution; 541430 ",https://www.wiserstrategies.com,Women-Owned,Active,Yes
"MAIN LINE XPRESS, LLC","3300 Ruckriegel Pkwy., Suite 108, Louisville, KY, 40299-3788",(502) 314-5824 or (502) 614-6753 Fax: 502-709-4974,"Related Services: 484121 – Specializing in General freight trucking, long-distance, truckload (TL) and Trucking, general freight, long-distance, truckload (TL) and 484122 – Specializing in General freight trucking, long-distance, less-than-truckload (TL), LTL (less-than-truckload) long-distance frei",https://www.mainlinexpress.com,Black-Owned,Inactive,Yes
