Business Name,Address,Phone,Services / Products,Website,Minority Type,Status,Kentucky Based
"DEANTO CORPORATION, LLC","36201 Henderson Mill Road, Apt. #12 D, Atlanta, GA, 30341",(470) 756-9569,"Related Services: 236210 - Specializing in Construction management for industrial buildings; 237310 - Specializing in Curbing, safety barrier, airport runway seal coating, airport runway striping, sidewalk, and construction management; and 238990 - Specializing in fencing installation",https://N/A,Black-Owned,Inactive,No
"DEPARTURE MEDIA, INC.","180 Meeting Street, Suite 350, Charleston, SC, 29401",(843) 571-2299 Fax: (843) 571-2294,"Concessionaire: 541810 - Specializing in Advertising Agencies and advertising agency consulting services; 541840 - Specializing in Advertising media representatives (i.e., independent of media owners), Magazine advertising representatives (i.e., independent of media owners), Media advertising repres",https://www.departure-media.com,Women-Owned,Active,No
"DHDC ENGINEERING CONSULTING SERVICES, INC.","2390 Advanced Business Center Drive, Columbus, OH, 43228",(614) 527-7656 or (937) 301-2595 Fax: (614) 527-7489,"Related Services: 541330 - Specializing in civil engineering services, construction engineering services and engineering consulting services; and 541380 - Specializing in geotechnical testing laboratories or services, laboratory testing (except medical, veterinary), and soil testing laboratories or ",https://www.dhdcinc.com,Asian-Owned,Active,No
"DIBIASE MATERIAL SOLUTIONS, INC.","4265 Inverrary Drive, Liverpool, NY, 13090",(315) 727-3043,"Related Services: BROKER: 425120 – Agents and brokers, durable goods, wholesale trade",https://N/A,Women-Owned,Inactive,No
"DIGITAL BUILDING SERVICES, LLC","11290 SW 30th Street, Miami, FL, 33165",(305) 202-1208,Related Services: 541340 - Specializing in computer-aided design drafting (CADD) services and drafting services,https://N/A,Latino-Owned,Inactive,No
"DIVERSE INDUSTRIAL SOLUTIONS, LLC","23 Johnson Lane, Clarksburg,, PA, 15725",(724) 388-0154,Related Services: 238290 – Other Building Equipment Contractors,https://N/A,"Black-Owned, Women-Owned",Inactive,No
"DK Bast Foundation Services, LLC","N/A, Leitchfield, KY, N/A",615-355-4773,Foundation Repairs,,Women-Owned,No Website,Yes
DLZ Corporation,"6121 Huntley Road, Columbus, OH, 43229",614-888-0040,"Engineering-Full service Multidisciplinary-Architectural, Environmental Professional Consulting;",http://dlz.com,Minority-Owned (general),Active,No
"DLZ Kentucky, Inc.","N/A, Lexington, KY, N/A",859-299-5226,"Consulting architects and engineers for civil, mechanical, electrical, and industrial engineering, environmental testing, asbestos removal, survey, hydraulics, dams, sewers, airports, bridges, hydrology drilling and testing, subdivision management, construction supervision, telephone and gas lines",http://www.dlz.com/,Minority-Owned (general),Active,Yes
"DMB Contracting, LLC","N/A, Lancaster, KY, N/A",859-339-9000,"Drywall, acoustic ceiling, and environmental permitting",,Women-Owned,No Website,Yes
"DORSEY ARCHITECTS AND ASSOCIATES, INC.","2301 1st Avenue North, Suite 101, Birmingham, AL, 35203",(205) 601-6576,Related Services: 541310 - Architectural Services,https://www.dorseyarchitects.com,Black-Owned,Active,No
DRIVE ENGINEERING CORP.,"595 Skippack Pike, Suite 400, Blue Bell, PA, 19422",(215) 367-5535 Fax: (888) 544-0270,"Related Services: 541330 – Engineering Services; 541340 – Drafting Services; 541512 – Computer Systems Design Services; 
541715 – Research and Development in the Physical, Engineering, and Life Sciences (except Nanotechnology and Biotechnology); and 541990 – All Other Professional, Scientific, and T",https://www.driveengineering.com,Latino-Owned,Active,No
"DUNN ELECTRIC, LLC","4304 Meadowbend Way, Louisville, KY, 40218",(502) 494-6640 Fax: (502) 709-5750,"Related Services: 221121 - Specializing in electric bulk power transmission and control - performing preventative maintenance; 221122 - Specializing in electric power distribution - performing installation services; 237130 - Specializing in performing cable installation, antenna construction, power ",https://www.dunnelectric.net,Black-Owned,Active,Yes
"DYNOTEC, INC.","2931 E. Dublin-Granville Road, Suite 200, Columbus, OH, 43231",(614) 880-7320 Fax: (614) 880-7324,"Related Services: 541330 - Specializing in civil engineering services, construction engineering services, consulting engineers' offices, engineering consulting services, engineering design services, engineering services, and traffic engineering consulting services

Prequalified Consultant: surveying",https://www.dynotecinc.com,Asian-Owned,Active,No
Daleos Construction LLC,"5508 GARROW AVE, FAIRDALE, KY, 40219",502-468-8821,"framing of new houses, additions,decks,remodelings, structure repairs,roofing;",http://daleosconstructionllc.com/,Minority-Owned (general),Inactive,Yes
"Darsh Consultancy Services, LLC","N/A, Prospect, KY, N/A",502-291-6693,"IT consulting services, custom programming & software development",https://www.DarshConsultancy.com,"Minority-Owned (general), Women-Owned",Inactive,Yes
"Data Systems Integration Group, Inc.","N/A, Dublin, OH, N/A",614-327-7348,"IT consulting, software, and services",http://www.dsiginc.com/,Minority-Owned (general),Active,No
Debbie Sutherland Excavating,"585 Browningtown Rd, Shepherdsville, KY, 40165",502-955-7161,Excavation;,,Women-Owned,No Website,Yes
Destiny Communications LLC,"6503 Seaton Lane, Louisville, KY, 40291",502-424-3484,"Security Systems, Network Cabling, Wifi. AV installations",http://destinycommunications.org,Minority-Owned (general),Inactive,Yes
"Destiny Communications, LLC","N/A, Louisville, KY, N/A",502-424-3484,"Network cabling, IT, security systems, Audio/Visual and low voltage interpreter close circuit television",http://www.destinycommunications.org/,Minority-Owned (general),Inactive,Yes
"Discount Cell, Inc.","N/A, Provo, UT, N/A",801-235-9809,"Government contract sales of cell phone and tablet accessories and equipment including cases, chargers, batteries, cellular data routers, antennas, signal boosters, Bluetooth, headsets and much more",https://www.discountcell.com,Women-Owned,Active,No
"Diverse Staffing Services, Inc.","7135 Waldemar Dr, Indianapolis, IN, 46268",317-813-8000,"Diverse Staffing provides temporary, temp-to-hire and direct hire workforce solutions. Our hybrid recruiting processes target, engage, and qualify top talent to fill any position, on demand and on budget. This unique model integrates online, mobile, social media, call center, and community-centric e",http://www.diversegov.com,Minority-Owned (general),Active,No
"Donna Lawrence Productions, Inc.","N/A, Louisville, KY, N/A",502-589-9617,Film & video production including special format immersive installations,https://www.dlproductions.com,Women-Owned,Active,Yes
"Doss & Horky, Inc.","N/A, Danville, KY, N/A",859-236-2690,"Construction (commercial); excavation, concrete, general contractor",https://www.dosshorky.com,Women-Owned,Active,Yes
"Dove Building Services, Inc.","N/A, Columbus, OH, N/A",614-299-4700,"Janitorial services, window cleaning and cleaning supplies. Carpet Cleaning & water treatment and supplies",https://www.dovebuildingservices.com,Minority-Owned (general),Active,No
"Down Ta Earth, Inc.","N/A, Science Hill, KY, N/A",606-423-2120,"Horizontal road bores for sewer, storm sewer & water",,Women-Owned,No Website,Yes
"Dr. James-Etta Consulting Group, LLC","N/A, Shelbyville, KY, N/A",502-966-7901,"Professional development services with the aim to advance social change and equity through workshops, training, and consulting",https://drjamesetta.com,"Minority-Owned (general), Women-Owned",Inactive,Yes
"DuMore Delivery Services, LLC","N/A, Louisville, KY, N/A",502-210-6997,Pickup and deliver general freight across the United States,,"Minority-Owned (general), Women-Owned",No Website,Yes
"Dunrobin Associates, LLC","N/A, Cold Spring, KY, N/A",859-781-9776,Management & technical consulting to public entities involving infrastructure or development,https://www.dunrobin.org,Women-Owned,Active,Yes
E-SQUARED CONSULTING CORPORATION,"43969 Tavern Drive, Suite 200, Ashburn, VA, 20147",(703) 858-5588 Fax: (703) 724-0983,"Consultant: 541611 – Specializing in Administrative management consulting services, Business management consulting services, General management consulting services, and Strategic planning consulting services; 541614 – Specializing in Transportation management consulting services; 541618 – Specializi",https://www.e-squared.org,Black-Owned,Active,No
"E. LEE TRUCKING, INC.","5949 River Road, Cincinnati, OH, 45233",(513) 315-3132 or (513) 290-5560 Fax: (812) 637-0224,"Related Services: BROKER: 425120 - Excluding petroleum and petroleum products agents and brokers; 484220 - Specifically dump trucking (e.g., gravel, sand, top-soil) gravel hauling, local; sand hauling, local; top-soil hauling, local",https://N/A,Black-Owned,Inactive,No
"E. TABB DESIGN CONSTRUCTION & DEVELOPMENT, LLC","1330 W. Breckenridge Street, Suite A, Louisville, KY, 40210",(502) 749-2004 or (502) 232-0655,"Related Services: 236220 – Specializing in the addition, alteration and renovation of Commercial and institutional building; Commercial warehouse; For-sale builders, commercial warehouse; For-sale builders, hotel and motel; For-sale builders, industrial warehouse; General contractors, commercial war",https://www.etabbllc.com,Women-Owned,Active,Yes
"E11even Keez Media, LLC + Creative","N/A, Lexington, KY, N/A",859-559-8975,"Wideography, photography, graphic design, writing, branding strategy, marketing strategy, on-camera talent services, and voiceovers",http://www.e11evenkeezmedia.com/,"Minority-Owned (general), Women-Owned",Inactive,Yes
"EARTH IMAGES, INC.","5868 Stiller Road, Floyds Knobs, IN, 47119",(800) 325-2543 Fax: (812) 923-7505,"Related Services: 237310 – Specializing in Bridge approach construction, Bridge construction, Grading highway, Road, Street and Airport runway, Highway Construction, Parkway Construction, Road Construction, Sidewalk public construction, Street Construction; 237990 – Specializing in Anchored earth re",https://www.earthimagesinc.com,Women-Owned,Active,No
"EATON CONSTRUCTION CO., INC.","PO Box 684, Circleville, OH, 43113",(740) 474-3414  or (740) 701-7070 Fax:  (740) 474-9616,"Related Services: 237310 - Specializing in highway construction, pavement, highway, road, street, bridge or airport runway construction, and highway, road, street, bridge or airport runway repair

Prequalified: waterproofing and sawing and sealing of cracks and joints",https://N/A,Women-Owned,Inactive,No
"EDUCATORS 4 EDUCATION, LLC","527 Primos Avenue, Folcroft, PA, 19032",(215) 792-3171,"Related Services: 611710 - Specializing in Career and vocational counseling services (except rehabilitative), College selection services, Educational consultants, Educational curriculum development services, Educational guidance counseling services, Educational support services, Educational testing ",https://www.educators4education.org,Black-Owned,Active,No
EHI CONSULTANTS,"333 W. Vine Street, Suite 300, Lexington, KY, 40507-1626",(859) 425-4881 or (502) 992-3194 Fax: (859) 254-8639,"Consultant: 541330 - Specializing in Civil engineering services, Construction engineering services, Consulting engineers' offices, Consulting engineers' private practices, Engineering consulting services, Engineering design services, Engineering services, Engineers' offices, Engineers' private pract",https://www.ehiconsultants.com,Black-Owned,Active,Yes
"ELAINE ALLEN, LLC","1200 North Limestone, Lexington, KY, 40505",(859) 368-7790,"Related Services: 236210 - Specializing in Addition, alteration and renovation - For-Sale builders, Industrial building (except warehouses) construction; general contractors, Industrial building (except warehouses) construction; Assembly plant construction; construction management, industrial buildi",https://www.elaineallenllc.com,Black-Owned,Active,Yes
"ELEMENT DESIGN, PLLC","366 S. Broadway, Lexington, KY, 40508",(502) 489-4221 or (859) 389-6533 Fax: (859) 389-6534,"Related Services: 541320 – Specializing in Architects’ offices, landscape; Architects’ private practices, landscape; Architectural services, landscape; City planning services; Garden planning services; Golf course design services; Industrial land use planning services; Land use design services; Land",https://www.element-site.com,Women-Owned,Active,Yes
"ELITE INDUSTRIAL PAINTING, INC.","1505 Savannah Avenue, Tarpon Springs, FL, 34689",(727) 641-4472 or (727) 940-6001 Fax: (727) 279-2827,"Related Services: 238320 – Painting and Wall Covering Contractors

Prequalified: bridge painting - Level B",https://N/A,Women-Owned,Inactive,No
"ELITE PROFESSIONALS, LLC","5174 S. University Drive, Davie, FL, 33328",(954) 680-6416 or (832) 266-9768 Fax: (954) 434-0929,Related Services: 561320 - Specializing in Temporary help services,https://www.eliteprofessionalsllc.com,Women-Owned,Active,No
EMCA Cleaning Services,"4033 Woodruff Ave, Louisville, KY, 40215",502-609-3604,Janitorial and cleaning services for commercial and medical spaces.,,Minority-Owned (general),No Website,Yes
EMED MEDICAL COMPANY LLC,"11551 ADIE RD, MARYLAND HEIGHTS, MO, 63043",314-739-6815,"Wholesale pharmaceutical products distributor, pre-packaged prescriptions, vaccines and injectable, specialty medical products, surgical supplies and diagnostics.",http://www.emedmedical.com,Minority-Owned (general),Active,No
"EMED Medical Company, LLC","N/A, Maryland Heights, MO, N/A",314-739-6815,"Brand and generic pharmaceuticals, medical surgery supplies, disposable medical supplies, pharmacy prescription services, managed care provider, promotional programs, direct distribution",https://www.emedmedical.com,Minority-Owned (general),Active,No
"ENA'S JERKMANIA, LLC d/b/a JUST JERKS","PO Box 15215, Lockland, OH, 45215-9998",(937) 369-9497,Concessionaire/Related Services: 722310 - Food Service Contractors; 722320 - Caterers; 722330 - Mobile Food Restaurants; and 722513 - Limited Service Restaurants,https://www.thatsjerk.com,"Black-Owned, Women-Owned",Active,No
"ENFINITY SUPPLY, LLC","1628 Shelby Oaks Drive, Suite 1, Memphis, TN, 39018",(901) 563-8008 Fax: (901) 422-7212,"Material Supplier: 423320 - Brick, Stone, and Related Construction Material Merchant Wholesalers; 423390 - Other Construction Material Merchant Wholesalers; 423510 - Metal Service Centers and Other Metal Merchant Wholesalers; 423830 - Industrial Machinery and Equipment Merchant Wholesalers; 423840 -",https://www.enfinitysupply.com,"Black-Owned, Women-Owned",Active,No
"ENVIROKINETICS, INC.","5411 Park Drive, Newburgh, IN, 47630",(812) 760-0330 or (812) 858-9043 Fax: (812) 858-9043,"Related Services: 541618 - Specializing in Telecommunications management consulting services and utilities management consulting services; 541620 - Specializing in Ecological restoration consulting, Environmental consulting, Environmental reclamation planning services, Sanitation consulting services",https://www.environmentkinetics.com,Black-Owned,Active,No
"EPR, P.C. d/b/a EPR CORP.","902 E. Jefferson Street, Unit 101, Charlottesville, VA, 22902",(434)202-5082 or (804) 647-7701 Fax: (866) 233-8801,"Related Services: 541330 – Engineering Services

Prequalified Consultant: advanced transportation planning engineering, conceptual transportation planning, pedestrian and bicycle planning and design, and transportation planning engineering",https://www.epr-pc.com,Women-Owned,Active,No
"ESP ENTERPRISES, INC.","13161 Misty Willow Drive, Houston, TX, 77070",(713) 429-5018 or (713) 970-0735 Fax: (888) 686-7694,"Related Services: 517810 - Specializing in On-line access service providers, using client-supplied telecommunications (e.g., dial-up ISPs); and 561320 - Specializing in Contract staffing services; Office help supply services; Temporary employment services; Temporary help services",https://www.espenterprisesinc.com,Latino-Owned,Inactive,No
"ESSAYON PROGRESS MANAGEMENT, LLC","560 Fairground Street, NE, Marietta, GA, 30060",(770) 423-2211 or (478) 972-7612,"Related Services: 236116 - Specializing in Apartment building construction, Condominium, multifamily, construction, Construction management, multifamily building, Cooperative apartment, construction, Duplex (i.e., one unit above the other), construction, Garden apartment construction, High-rise apar",https://www.EssayonPM.com,Black-Owned,Active,No
"ETCH, LTD","2967 Switzer Rd, Suite D, Columbus, OH, 43219",614-507-6533,"With a unique focus on Geographic Information Systems (GIS) technology, Etch provides clients with customized solutions that streamline everyday business and operational workflows. We specialize in organizational development, GIS planning and design, asset management and data conversion and delivery",http://www.etchgis.com,Women-Owned,Active,No
"ETCH, LTD.","2967 Switzer Avenue, Suite D, Columbus, OH, 43219",(614) 507-6533,Related Services: 541360 – Geophysical Surveying and Mapping Services; 541370 – Specializing in Geographic information system (GIS) base mapping services and Geospatial mapping services; 541512 – Specializing in Computer hardware consulting services or consultants; Computer software consulting servi,https://www.etchgis.com,Women-Owned,Active,No
"EXECUTIVE CLASS TRANSPORTATION, LLC","PO Box 21093, Louisville, KY, 40221",(502) 509-5884,"Related Services: 485320 - Specializing in Automobile rental with driver (except shuttle service, taxi); Luxury automobiles for hire with driver (except shuttle service, taxi); and Passenger van rental with driver (except shuttle service, taxi)",https://www.executiveclasstransport.com,"Black-Owned, Women-Owned",Active,Yes
"Edward Holmes, Inc.","815 West Market Street, Suite 304, Louisville, KY, 40202",502-992-3194,EHI is certified to provide expertise in urban and land use planning and environmental and civil engineering services.,http://www.ehiconsultants.com,Minority-Owned (general),Active,Yes
"Element Design, PLLC","366 South Broadway, Lexington, KY, 40508",502-489-4221,"Landscape architectural, planning and civil engineering services including all phases from concept development through construction administration",http://www.element-site.com,Women-Owned,Active,Yes
Elite Pro Building Services LLC,"N/A, Florence, KY, N/A",859-414-2440,"Cleaning for commercial properties – warehouses, offices, and retail spaces, and floor cleaning services",https://www.goelitepro.biz,Minority-Owned (general),Inactive,Yes
"Ellis & Associates Realtors/Appraisers, Inc.","P O Box 99278, Louisville, KY, 40269",502-267-4044,"Real Estate Appraisals - Commercial and Residential properties, Real Estate Brokers",http://www.ellisandassociates.com,Minority-Owned (general),Inactive,Yes
"Elm Street Resources, Inc.","N/A, Paintsville, KY, N/A",606-789-4036,Coal supplier/broker,,Women-Owned,No Website,Yes
"Engaging Solutions, LLC","N/A, Indianapolis, IN, N/A",317-283-8300,"Fiscal management & accountability, diversity service, community outreach & fund development",https://www.engagingsolutions.net,"Minority-Owned (general), Women-Owned",Active,No
Engineered Solutions Inc.,"1850 TAYLOR AVE STE 11, Suite #11, Louisville, KY, 40213",502-485-1515,"Engineering, Management;",http://www.esi-lou.com,Women-Owned,Active,Yes
Environs Inc.,"N/A, Louisville, KY, N/A",502-243-1091,Landscape planning & design,https://www.environsinc.com,Women-Owned,Active,Yes
"Evelez, LLC","N/A, Louisville, KY, N/A",502-644-2075,"Office administration, data entry, business consulting & staffing, Truck leasing services, Spanish-English interpretation and translation services",,"Minority-Owned (general), Women-Owned",No Website,Yes
"Executive Residential Elevator, LLC dba Executive Elevator Co.","N/A, Louisville, KY, N/A",502-636-1993,"Elevator service, repair, installations and modernizations",https://www.exelevator.com,"Minority-Owned (general), Women-Owned",Inactive,Yes
"Expedited Transportation Services, Inc.","N/A, Stone Mountain, GA, N/A",770-413-1700,Third party logistics firm handling all aspects of domestic & international transportation of freight,https://www.ets-atlanta.com,Women-Owned,Active,No
"Experts in Growth Leadership Consulting, LLC dba EiGL Consulting, LLC","N/A, Louisville, KY, N/A",502-419-2433,"Consulting, coaching, training, motivational speaker",https://eiglconsulting.com,"Minority-Owned (general), Women-Owned",Inactive,Yes
"F8TH CONSTRUCTION COMPANY, LLC",3314 Lewisburg Hwy (P),Office: (931) 227-4197 Cell: (931) 637-0838,Related Services: 237310 - Specializing in guardrail installation,https://N/A,Women-Owned,Inactive,Yes
"FACILITY MAINTENANCE & SERVICES GROUP, LLC","2121 Richmond Road, Suite 227, Lexington, KY, 40502",(859) 554-6584 or (859) 333-1610 Fax: (859) 201-1359,"Related Services: 238320 - Specializing in Electrostatic painting, on-site, contractors, House painting, Paint and wallpaper stripping, Painting (except roof) contractors, Painting and wallpapering, Paperhanging and removal contractors, Paperhanging or removal contractors, Wall covering or removal c",https://www.facilitymsg.com,Black-Owned,Active,Yes
"FAIRPOINTE PLANNING, LLC","73 White Bridge Road, Suite 103-235, Nashville, TN, 37205",(615) 657-9685 or (615) 243-6590,"Related Services: 541611 - Specializing in Administrative management consulting services; Business management consulting services; General management consulting services; and Strategic planning consulting services

Prequalified Consultant: transit management, transit technical studies, conceptual tr",https://www.fairpointeplanning.com,"Black-Owned, Women-Owned",Active,No
"FAMILY, AGAIN LIMITED LIABILITY COMPANY","223 SHAWNEE DR, LOUISVILLE, KY, 40212",502-776-8000,Career and vocational counseling services (except rehabilitative),,Minority-Owned (general),No Website,Yes
"FCC CONSULTING SERVICES, LLC","39 Birmingham Drive, Columbus, NJ, 8022",(844) 322-5521 ext. 701,"Related Services: 541512 - Specializing in computer hardware and software consulting services or consultants; computer systems integration analysis and design services; information management computer systems integration design services; network systems integration design services, computer; systems",https://www.fccconsultingservices.com,Black-Owned,Active,No
"FEASIBILITY RESEARCH GROUP OHIO, LLC","13940 Cedar Road, Suite 196, University Heights, OH, 44118",(216) 920-7573 or (216) 470-5426,Related Services: 531320 - Offices of real estate appraisers,https://www.frg-consultants.com,Black-Owned,Active,No
"FELTUS HAWKINS DESIGN, LLC d/b/a FH DESIGN, LLC","1207 A McGavock Street, Nashville, TN, 37203",(615) 244-4328 or (615) 320-8258,Related Services: 541310 – Architectural Services; and 541410 – Interior Design Services,https://www.fhdesign.com,Women-Owned,Active,No
"FERGUSON LEARNING COMPANY, LC","178 Owl Overlook, Burlington, KY, 41005",(859) 512-8417 or (859) 912-5117,Related Services: 541611 - Specializing in Administrative management consulting services; Business Management consulting services; General management consulting services; Reorganizational consulting services; and Strategic planning consulting services; 541612 - Specializing in Employee assessment co,https://www.fergusonlearning.com,Women-Owned,Active,Yes
"FERGUSON LEARNING COMPANY, LC","178 OWL OVERLOOK, BURLINGTON, KY, 41005",859-912-5117,Employee assessment consulting services; Human Resources Consulting Services; Other Management Consulting Services; Professional and Management Development Training ; Administration of Education Programs,http://fergusonlearning.com,Women-Owned,Active,Yes
"FIELDTRIP, LLC","642 S. 4th Street, Suite 400, Louisville, KY, 40202",(502) 882-9011 or (502) 905-0059,"Related Services: 541430 - Art services, commercial; Art services, graphic; Art studios, commercial; Artists, independent commercial; Artists, independent graphic; Artists, independent medical; Commercial art services; Commercial artists, independent; Commercial illustration services; Commercial ill",https://www.hellofieldtrip.com,Women-Owned,Inactive,Yes
"FIRST CHOICE COMMERCIAL SERVICES, INC.","224 Carter Avenue, Louisville, KY, 40229",(502) 964-1721 or (502) 957-1814  Fax: (502) 957-3773,"Related Services: 238990 - Specializing in focusing on cleaning building interiors during and immediately after construction and cleaning new building interiors immediately after construction; and 561720 - Specializing in interior building cleaning services, janitorial building cleaning services, cl",https://www.Firstchoiceinc.org,Women-Owned,Active,Yes
"FIRST STAR SAFETY, LLC","PO Box 157280, Cincinnati, OH, 45215",(513) 661-7827 or (513) 661-7828 or (513) 509-3644 Fax: (513) 661-7829,"Related Services: 237310 - Specializing in Airport runway line painting (e.g., striping), Highway line painting, Painting lines on highways, streets and bridges, Painting traffic lanes or parking lots, Parking lot marking and line painting, Runway, airport, line painting (e.g., striping), Sign erect",https://www.firststarsafety.com,Women-Owned,Active,No
FIRST WORLD ARCHITECTS STUDIO,"13 East 9th Street, Covington, KY, 41011",Office: (859) 431-1999 Direct: (859) 250-2884 Secondary: (859) 431-2021,"Related Services: 236116 - Specializing in Construction management, multifamily building; Cooperative apartment, construction general contractors; Low income housing, multifamily, construction general contractors; Panelized multifamily housing assembled on site by general contractors; Precut multifa",https://www.1stworldarchitectsstudio.com,Black-Owned,Active,Yes
