"Inner Plant Systems, Inc.  ",2026-10-30 00:00:00,WBE,Supplier/Distrubutor,"Diesel fuel, off-road, oil and lubes, and equipment for fuel",Tammy Elmore,Jefferson,Louisville,KY,502-931-0300,
"Inside Out Design, LLC dba Inside Out Landscape Design, LLC  ",2027-02-28 00:00:00,WBE,Professional Services,"Landscape & hardscape design & installation & commercial properties, including paver patios & walks, fire pits, drainage solutions, lighting, pergolas, etc.",Andrea Wilson Mueller,Franklin,Frankfort,KY,502-695-7020,https://kentuckylandscapedesign.com/
"Integrated Power and Technology, LLC",2026-08-30 00:00:00,MBE,Contractor,Industrial and commercial electrical contracting,Larry Middleton,Jefferson,Louisville,KY,502-876-1669,https://integratedpt.net/
"Interapt, LLC",2027-04-30 00:00:00,MBE,Professional Services,"Information technology services to companies, including mobile/web app development, IT support services, data science and cloud engineering",Ankur Gopal,Jefferson,Louisville,KY,502-251-1511,https://interapt.com/
"Interpreting Service of the Commonwealth, LLC ",2027-10-30 00:00:00,WBE,Professional Services,American Sign Language - English Interpreting ,Robin Bush,Pulaski,Somerset,KY,606-401-2328,https://www.iscky.net/
"Interspace Limited, LLC",2028-01-30 00:00:00,WBE,Professional Services,Interior Design,Allison Worsham,Fayette,Lexington,KY,859-252-0000,https://www.interspacelimited.com/
"Ironweed Native Plant Nursery, LLC ",2028-09-30 00:00:00,WBE,Retail,Grow and sell native container plants,Alicia Bosela ,Shelby,Waddy,KY,270-350-2837,https://www.ironweednursery.com/
IT Transformers Inc. dba Metamor Systems ,2028-04-30 00:00:00,MBE,Professional Services,IT Staffing and software development,Bala Krishnamurthy,Hamilton,Carmel,IN,317-514-6172,https://www.metamorsys.com/
"J and JB, LLC dba J and JB Construction and Framing",2028-01-30 00:00:00,MBE,Contractor,"Commercial and Institutional Building construction, and the firm’s primary services are demo, rehab, new build, foundation and footers, framing wood and metal, window and door installs, roofing, excavation work, residential homed demo/teardown, concrete work, construction cleanup, flooring, drywall, and debris removal",Joe Madison,Fayette,Lexington,KY,859-494-7254,
"J. Cortez, LLC",2026-08-30 00:00:00,MWBE,Retail,"Retail sales of sea moss gel, drinks, and capsules",Quintina McDowell,Jefferson,Louisville,KY,502-912-3492,https://seamossbyjcortez.com/
"Jacks or Better Express, LLC",2026-12-30 00:00:00,WBE,Trucking,"Local general freight trucking, long distance general freight trucking, local specialized freight trucking, and long distance specialized freight trucking",Shasta McCubbins,Nelson,Bardstown,KY,502-249-0647,
"Jacobi Oil Service, Inc.",2028-01-30 00:00:00,WBE,Supplier/Distributor,"Delivery of petroleum products, gasoline, diesel fuel, heating oil & lubricants",Elaine M. Jacobi,Floyd,Floyds Knobs,IN,812-923-5174,https://jacobioil.com/
JADE Realty Group Limited Liability Company,2028-01-30 00:00:00,MWBE,Broker,Real estate services & notary public,Patricia Ann King,Hardin,Rineyville,KY,270-317-0087,
"James E. Forst & Associates, Inc.",2026-12-30 00:00:00,WBE,Professional Services,"Mechanical, electrical, and plumbing engineering design for buildings",Susan F. Mersch,Jefferson,Louisville,KY, 502-584-4033 ,http://www.forstengineering.com/
Jason E Davis Homes LLC dba J E Davis Construction LLC,2027-10-30 00:00:00,WBE,Contractor,Construction services,Jodi Davis,Bullitt,Shepherdsville,KY,502-931-4609,
Javier Steel Corporation,2027-06-30 00:00:00,MBE,Subcontractor,"Tie & place reinforcing steel, install SIP bridge deck forms, erect precast & structural beams",Nilo A. Javier,Jefferson,Louisville,KY,502-426-2008,
"Jean Henry WBE, LLC dba Lawrence & Associates Concrete Design ",2027-04-30 00:00:00,WBE,Contractor,"Concrete sidewalks, ADA ramps, concrete patios, decorative concrete curbs, driveways, curbs, and drainage improvements, and historic hardscape preservation",Jean Henry,Jefferson,Louisville,KY,502-899-9588,https://www.lawrenceconcrete.com/
"JEC Creative Designs, LLC",2029-05-30 00:00:00,WBE,Retail,"HTF/DTF shirt transfers and products, door signs, and gifts",Julie E. Corbett,Jefferson,Lousiville,KY,502-558-0053,
"Jessica Michele, LLC dba Pretty Is As Pretty Does, dba Gecca Apparel, dba Gecca Digital Designer",2027-03-30 00:00:00,WBE,Other ,"Boutique, digital interior design, and real estate purchaser and development",Jessica Michele Embry,Grayson,Leitchfield,KY,606-922-9931,"Please provide website address, if applicable"
JK Love Limited Liability Company dba Built with Love,2028-01-30 00:00:00,MWBE,Contractor,Commercial painting and house builder,Kisha Johnson,Jefferson,Louisville,KY,502-677-9226,
"Joes Do It All, LLC",2027-10-30 00:00:00,MBE,Contractor,"Commercial and residential construction, demo, rehab, new build, foundation and footers, farming wood and metal, windows and doors, installation, roofing, and excavation work, residential home demo, concrete work, construction clean-up, dumpsters, and flooring",Joe Madison,Fayette,Lexington,KY,859-285-2004,
"Johnson Benefit Consulting, LLC dba JBC Pros",2029-01-30 00:00:00,WBE,Professional Services,"Employee benefit administration and consulting, FSA, HRA, HSA, COBRA, ERISA, and Form 5500s",Lauren Johnson,Fayette,Lexington,KY,859-479-1882,https://jbcpros.com/
"Jostin Construction, Inc.",2026-12-30 00:00:00,MBE,Contractor,"Commercial concrete construction, construction management, and general contracting",Albert Smitherman,Hamilton,Cincinnati,OH,513-559-9390,https://jostinconstruction.com/
"JQOL Global, LLC",2026-08-30 00:00:00,MBE,Professional Services,Civil engineering services,Jarvis Jointer,Marion,Indianapolis,IN,317-661-1964,https://www.jqolusa.com/
"JQOL, Inc.",2028-01-30 00:00:00,MBE,Professional Services,Civil Engineering,Jarvis Jointer,Marion,Indianapolis,IN,317-610-1203,http://www.jqolusa.com/
JR'S Lawn & Landscaping LLC dba Jr's Lawn & Landscaping                       ,2027-03-30 00:00:00,MBE,Subcontractor,Lawn and landscaping installation and maintenance,"Ernest Robertson, Jr.",Oldham,LaGrange,KY,502-356-3816,"Please provide website address, if applicable"
"Julie Collins Consulting Arborist & Tree Health Services, LLC",2027-05-30 00:00:00,WBE,Professional Services,"Aboriculture services, tree health care, consulting, tree protection plans, arborist reports, tree installation, landscape design, and tree risk assessment",Julie Collins,Kenton,Walton,KY,859-393-7393,https://treecarebyjulie.com/
"Junk-Be-Gone, LLC",2027-03-30 00:00:00,MBE,Other ,"Junk removal, dumpster rental, interior and small structure demolition and hauling",Larry Balew,Boone,Union,KY,859-743-0044,https://junkbegone1.com/
Kaptivative HR Solutions LLC,2028-04-30 00:00:00,MBE,Professional Services,"Human resources and talent acquisition consultant, educational consultant, government contractor, and business services",Aaron Carter III,Campbell,Newport,KY,513-999-1038,https://kaptivative.com/
"KECH, Inc.",2028-01-30 00:00:00,WBE,Professional Services,IT Services and contact center services,Christine Carpenter,Whitley,Williamsburg,KY,606-703-0347,https://www.kechco.com/
Kentuckiana Off-duty Police & Surveillance Inc,2026-05-30 00:00:00,MWBE,Other,"Law EnforcementOfficer (LEO) traffic control and security services, utilizing certified police and deputies who meet all KYTC LEO requirements, including the use of agency-issued vehicles in accordance with KRS.",Teresa McDaniel,Nelson,Coxs Creek,KY,877-880-5677,https://www.kopsinc.com/
"Kentuckiana Sheet Metal, Inc. ",2028-05-30 00:00:00,MBE ,Contractor,Fabricate sheet metal duct work and install on job site. Install commercial HVAC equipment ,James E. Marshall Jr. ,Jefferson,Louisville,KY,502-635-7689,https://kysheetmetal.com/
"Kentuckiana Tire Recycling, LLC",2027-04-30 00:00:00,WBE,Other ,"Tire removal services, tire collection, and tire shredding",Patricia Killion,Jefferson,Louisville,KY,502-822-3809,http://kyusedtires.com/
"Kentucky AgriTech, LLC",2027-10-30 00:00:00,WBE,Professional Services,"Software Development, Product Development, AgTech Consulting, Research & Development",Ricky Mason,Jefferson,Louisville,KY,502-821-8960,https://www.kyagritech.com/
"Kentucky Cut Stone, LLC",2026-08-30 00:00:00,WBE,Supplier/Distributor,"Non-coal surface mine, producer of natural limestone building stone",JoEl Ford,Garrard,Lancaster,KY,606-669-1174,https://kentuckycutstone.com/
"Kentucky Farm Girl, LLC",2028-01-30 00:00:00,MWBE,Consultant,Consulting existing & start-up growers to connect with each other to collaborate a network of growers,Darlene Prather,Henderson,Henderson,KY,270-724-4977,
Kentucky Recycling LLC ,2027-07-30 00:00:00,WBE,Other ,Collections and processing of recyclable material from local industries and Eastern Kentucky University,Ashley Reisig,Madison,Richmond,KY,859-779-5095,
"Kersey & Kersey, Inc.",2026-08-30 00:00:00,WBE,Professional Services,"Architecture, planning, interior design",Cheryl C. Kersey,Jefferson,Louisville,KY,502-583-0094,https://kerseyandkersey.com/
Kingsley Consulting LLC DBA Kingsley + Co.,2028-10-30 00:00:00,MBE,Professional Services,"Commercial real estate investment and development work focused on revitalizing communities, property redevelopment, asset management, leasing, design-build services, acquisitions, investment and financing, and sustainability-driven projects",Chinedum Ndukwe,,Cincinnati,OH,614-753-1491,https://www.kingsleyandcompany.com/
"Klein Printing, Inc. ",2026-06-30 00:00:00,WBE,Manufacturer,"Printing, graphic design, promotional items & uniforms",Mary Lou Klein,Kenton,Covington,KY,859-341-4774,https://www.kleinprinting.com/
"Kong Xpress, LLC",2027-03-30 00:00:00,MBE,Trucking,Dump trucking,Jonnathon Booth,Clark,Clarksville,IN,812-557-5817,"Please provide website address, if applicable"
"KPC Architectural Products, Inc.",2027-03-30 00:00:00,WBE,Supplier/Distributor,Furniture merchant wholesaler and design company,Angie Smith,Fayette,Lexington,KY,859-269-3646,https://kpcarch.com/
"Kundlas Consulting Group, LLC ",2028-04-30 00:00:00,MBE,Consultant,Environmental Consulting; Consulting Management; Construction Management; Grants Management,Sandeep Singh,,Whitestown,IN,718-414-9730,https://kundlasgroup.com/
"Landmark Construction, LLC ",2026-12-30 00:00:00,WBE,Contractor,"Excavation, Dirt Hauling, Walls/Bridges, Concrete",Laura Feltner,Perry,Hazard,KY,606-216-1485,www.landmarkconstruct.com
"Landscaper's Corner, Inc. ",2027-04-30 00:00:00,WBE,Other ,"Landscape supply company include mulches, decorative gravels, soil amendments, grass seed, vegetable seed, straw, pine straw, tools, and natural stone",Elaine Pence,Fayette,Lexington,KY,859-225-9433,
"LC Hauling, LLC",2029-01-30 00:00:00,MWBE,Other,Transportation of heavy equipment and construction supplies. Along with various other items.,Ana Feria & Megan Feria,Jefferson,Louisville,KY,502-386-1376,https://www.lchauling.com/
"Leach Communications, LLC",2028-04-30 00:00:00,WBE,Professional Services,"Writing, editiing, communciations",Tanya Bricking Leach,Kenton,Covington,KY,859-653-0893,https://www.clippings.me/tanyaleach
"Leadership Bridges, LLC",2028-08-30 00:00:00,WBE,Consultant,"Business consulting for government and nonprofit organizations in strategic planning, governance, leadership coaching and development, teambuilding, organizational design, and strategic alliances",Florence W. Tandy,Kenton,Erlanger,KY,859-582-5603,https://leadershipbridges.com/
"LEAN Business Solutions, LLC ",2026-05-30 00:00:00,MBE,Consultant,"Consultant for efficiency improvement opportunities. Coaching, training and presentations",Alonzo Allen,Scott,Georgetown,KY,502-863-2933,
"Leapspark, LLC",2027-05-30 00:00:00,WBE,Professional Services,"Video Production (concept to completion, scripting, shooting, editing, post-production), Photography (on-location, studio, retouching), Animation (2D, 3D, character animation, motion graphics, explainer videos), Campaign Production (ideation, execution, marketing campaigns), Social & Micro-Content (short-form videos, graphics, interactive content, Augmented Reality (AR filters, AR apps, interactive installations), Virtual Reality (VR video production, VR apps, virtual tours), Experiential Content (pop-up events, interactive installations, event production, experiential marketing), Influencer Content (influencer marketing strategy, content creation, campaign management).",Ember Marr,Jefferson,Louisville,KY,502-579-2323,https://leapsparkagency.com/
"LECGI, Inc. ",2027-03-30 00:00:00,MWBE,Professional Services,"Structural engineering, steel detailing (shop and fabrication draws) & drafting services",Don (Dongfa) Liu,Jefferson,Louisville,KY,502-425-1647,https://www.lecgi.us/
"LEDAMARK, Inc. ",2026-05-30 00:00:00,WBE,Contractor,"Installation of equipment - pallet rods, security cages and storage containers, pumps, motors, exhaust fans, flag poles, key/cone locks",Phyllis Stephens,Powell,Stanton,KY,402-250-9033,http://www.ledamark.com/
"Legacy Contracting, LLC",2026-08-30 00:00:00,MBE,Contractor,"Residential and commercial roofing, gutters, remodeling, framing, and general contracting",Shamere Grant,Jefferson,Louisville,KY,502-690-0899,
"Legend Painting, Inc.",2026-02-28 00:00:00,WBE,Contractor,Bridge painting,Kaliopy Valvoulas,Mahoning,Campbell,OH,330-953-3264,
"Lestar Mineral Development, Inc.",2026-05-30 00:00:00,MBE,Supplier/Distributor,Asphalt & steel,Lester Boyd,Fayette,Lexington,KY,859-608-9926,https://lestarinc.com/
"Level Up Consulting, LLC",2028-01-30 00:00:00,MWBE,Consultant,"Education consulting, training, and retail sales – books",Candice Christina Hardin,Jefferson,Louisville,KY,502-619-2293,https://www.321levelup.com/
"Lexington Podiatry, PSC",2027-05-30 00:00:00,WBE,Professional Services,Full scope podiatry medical services,"Nicole G. Freels, DPM",Fayette,Lexington,KY,859-967-7168,https://www.lexingtonkypodiatry.com/
"LexLou Data Analytics, LLC",2027-10-30 00:00:00,WBE,Consultant,"Platform as a Service (PaaS) Development, Deployment, Documentation, and Training Data Management and Migration Data Analytics and Business Intelligence, CRM and Data Application Development and Implementation System development, Data Strategy and Business Process Development, Technical Writing and Documentation, Administrator and End User Training Delivery and Materials Data-related Project Management",Nicole Smith,Fayette,Lexington,KY,312-316-9863,https://www.lexloudata.com/
"Lifestone Dynamic, LLC",2026-08-30 00:00:00,MBE,Contractor,New construction and remodeling,Bernardo Caballero,Jefferson,Louisville,KY,502-797-3022,https://www.lifestonedynamic.com/
"Lincoln Manufacturing USA, LLC",2027-12-30 00:00:00,MBE,Manufacturer,"Metal stamping facility with the capability to manufacture a wide range of parts from simple stampings to close tolerance critical parts; as well as, projection welding, grinding & lathe operations; our largest volume types of parts supplies to our different customers are transmission parts; tier 2 Supplier Ford, Honda Toyota, Nissan, BMW, General Motors, Mazda & Chrysler Corporation",Masato Sugimura,Lincoln,Stanford,KY,606-365-3016,https://www.lincolnmfg.com/
"Little Creek Construction, Inc.",2028-08-30 00:00:00,WBE,Contractor,"Installation of rural water lines by trenching and additional bores, and underground utilities",Rebecca Tolliver,Greenup,Greenup,KY,606-473-6296,
"LL Brown, LLC",2028-01-30 00:00:00,MWBE,Contractor,"Bridge cranes, hydraulic truck cranes, piling, and demotion services broker, crane and rigging rental and operators",Vickie Lynn Brown,Scott,Scottsburg,IN,502-643-5563,
"LMH Accounting & Consulting, LLC ",2026-10-30 00:00:00,MWBE,Professional Services,"Accounting services, auditing, payroll, taxation, financial statement preparation, bookkeeping, fraud investigation, forensic accounting ",Latanya M. Henry,Jefferson,Louisville,KY,502-996-7150,https://lmhaccounting.com/
"Lola's Laundry, LLC",2026-08-30 00:00:00,MWBE,Retail,Laundromat and laundry services,Melinda and Leonard Bredwood,Scott,Georgetown,KY,859-333-6288,https://lolaslaundryky.com/
"Longevity Power Wash, LLC ",2028-05-30 00:00:00,MBE ,Other ,"Truck washing, residential and commercial power washing, fuel station and restaurant cleaning, graffiti removal, waste water recovery systems ",Keith Brooks,Jefferson,Louisville,KY,502-276-6309,http://www.longevitypowerwash.com/
"Lots & More, INC.",2029-01-30 00:00:00,MBE,Contractor,"Property Maintenance, renovations and construction",Noah Lockhart,Jefferson,Louisville,KY,502-821-8787,
"LR Hawkins, LLC",2027-03-30 00:00:00,MWBE,Professional Services,"Tax preparation, bookkeeping, and Notary Signing Agent",Lemeka Hawkins,Fayette,Lexington,KY,859-552-5986,"Please provide website address, if applicable"
"Lunar Wellness & Fitness, LLC",2027-10-30 00:00:00,WBE,Professional Services,"Personal training, therapeutic massage, nutrition coaching, online training programs and wellness resources",Leanne Marie Fritz,Madison,Louisville,KY,502-921-3352,https://lunarfitnesswellness.square.site/
"Lykins Reinforcing, Inc.",2026-12-30 00:00:00,WBE,Subcontractor,Installation of reinforcing steel and post tensioning for concrete,Donna Lykins,Jefferson,Louisville,KY,502-634-5030,
"M&M Finishing, LLC",2026-12-30 00:00:00,WBE,Manufacturer,Application of metal & ceramic coating to industrial components,M. Elizabeth Schlemmer,Boone,Walton,KY,859-485-1100,https://www.mandmfinishing.com/
"M. Martinez Stone, LLC dba Missy Martinez-Stone ",2028-10-30 00:00:00,MWBE,Consultant,"Operations and Administrative Management, Systems and HR Consulting",Missy Martinez-Stone,Jefferson,Louisville,KY,540-903-5680,
"Mackey Group, LLC dba Wiser Strategies",2027-03-30 00:00:00,WBE,Professional Services,"Communication consulting and creative services firm. Services include public relations plan development, media relations & publicity, opinion research, branding, advertising, video production, photography, writing, graphic design, digital & social media, crisis response and management, public input, and event planning & promotion",Nancy Wiser,Fayette,Lexington,KY,859-227-8850,https://wiserstrategies.com/
"Make It Plain Consulting, LLC ",2027-03-30 00:00:00,MBE,Professional Services,"Human resources, economic inclusion, workforce training, performance coaching",Tommie Lewis Jr.,Hamilton,Cincinnati,OH,513-421-2300,http://mipcllc.com/
"Mamula Contracting, LLC",2028-04-30 00:00:00,WBE,Contractor,General contracting and construction materials,Karen Mamula,Trumbull,Warren,OH,330-240-8007,
"Maps + Apps, LLC",2028-01-30 00:00:00,WBE,Professional Services,"Geographic Information Systems (GIS) Services GIS Data Collection, Management, and Analysis GIS Application Development and Custom Solutions Spatial Data Infrastructure Design Mapping and Cartography Interactive Web and 3D Mapping Cartographic Services Environmental and Sustainability Services",Brita Austin,Warren,Bowling Green,KY,270-935-0296,
"Maria Ladd Consulting, LLC",2027-03-30 00:00:00,WBE,Consultant,Public relations,Maria Ladd,Jefferson,Prospect,KY,502-262-0353,"Please provide website address, if applicable"
"Marine Solutions, Inc.",2027-03-30 00:00:00,WBE,Professional Services,"Marine engineering, bridge engineering, and construction commercial diving",Amy Wilkins,Jessamine,Nicholasville,KY,859-260-1055,https://www.msimarinesolutions.com/
"Martin Elite Realty Company, LLC dba Martin Elite Realty Company",2028-01-30 00:00:00,MBE,Professional Services,Real estate brokerage services,Desmond Martin,Jefferson,Louisville,KY,502-553-3296,https://www.martineliterealty.com/
"Mary's Cleaning Service, LLC",2027-03-30 00:00:00,MWBE,Contractor,"Cleans commercial buildings, floor car, general & deep cleaning",Mary Anthony,Fayette,Lexington,KY,859-270-9509,
"Mastin Construction, Inc.",2028-08-30 00:00:00,WBE,Contractor,"General construction, demolition, street sweeping, vacuum trucks, environmental services, facility maintenance, and hydroseeding",Jamie Mastin,Harrison,Cynthiana,KY,513-582-1629,https://www.mastinconstruction.com/
Maximilian Eisenburger,2027-10-30 00:00:00,MBE,Consultant,"Economic and real estate consulting services, fiscal impact analysis, entrepreneurial ecosystem assessment",Maximilian Guerrero Eisenburger,Fayette,Lexington,KY,(773) 540-5969,
"Maynard & Mitchell Interiors, Inc. dba M & M Interiors",2029-05-30 00:00:00,WBE,Subcontractor,"Commercial drywall, acoustical ceilings, metal stud framing, door frames & hardware EIFS, drywall finishing, cold-formed metal framing, trusses ",Monica Thomas ,Jefferson,Louisville,KY,502-384-8109 ,https://mm-interiors.net/
"MC Innovations, LLC",2027-10-30 00:00:00,WBE,Professional Services,"Self-insurance claims management, loss control & safety,  pharmacy benefit management, medical bill review, and durable medical equipment supply",Judith Hays,,Richmond,VA,804-344-0009,https://mcinnovations.com/
"McAllister Transport, LLC dba McAllister Excavation",2029-04-30 00:00:00,WBE,Subcontractor,Dump truck services & excavation,Amber McAllister,Bullitt,Brooks,KY,502-762-7327,
"McGeeney Consulting Partners, LLC",2027-05-30 00:00:00,WBE,Professional Services," Data analysis and visualization consulting, with a focus in health and human services",Teresa McGeeney,Jefferson,Louisville,KY,502-649-3339,https://www.mcpdata.com/
"MCLabs, LLC dba Fastest Labs of Florence",2029-04-30 00:00:00,MBE,Professional Services,"Drug testing, alcohol testing, and DNA testing services",Miguel Concepcion,Boone,Florence,KY,859-907-3575,fastestlabs.com/Florence
"MCN Moving Cargo Now, LLC",2026-12-30 00:00:00,MWBE,Trucking,Transport of over the road freight and dry freight throughout the United States,Elaine Collins,Graves,Mayfield,KY,270-970-1019,https://movingcargonow.biz/
"Metric Environmental, LLC",2029-04-30 00:00:00,MBE,Professional Services,"Assessment and remediation, asbestos & lead inspections, architectural/history & archaeological investigations, natural resources management, industrial hygiene and occupational safety, NEPA services, stormwater permitting and compliance support, environmental documentation",Kenneth Beache,,Indianapolis,IN,317-400-1633,https://metricenv.com/
"MG Excavating, LLC",2027-07-30 00:00:00,WBE,Subcontractor,"Excavating, dredging trenching, demolition and clearing",Julia Guilfoyle,,Brookville,IN,765-309-6722,
"Michele Wilson Jones, Attorney at Law",2026-05-30 00:00:00,WBE,Professional Services,Legal services including but not limited to Real Estate transactions; deed preparation; mortgage preparation; foreclosures; loan closings; private closings; and title abstracting,Michelle Wilson Jones,McCreary,Whitley City,KY,606-310-1965,https://michelewilsonjones.com/
"Miller Consultants, PBC ",2026-10-30 00:00:00,WBE,Consultant,"Management consulting, Organizational Development Training, Executive Coaching, Organizational Assessments",Kathleen Miller-Perkins,Jefferson,Louisville,KY,502-452-1751,https://www.millerconsultants.com/
"Mills Supply Co., Inc. ",2027-12-30 00:00:00,WBE,Supplier/Distributor,"Rebar fabrication, Concrete Reinforcement ",Kathy Mills ,Jefferson,Louisville,KY,502-561-0700,https://www.millssupply.net/
"Minority Brokers, LLC",2027-07-30 00:00:00,MBE,Supplier/Distributor,"HVAC, plumbing, and electrical supplier",Cedric Knight,,New Albany,IN,502-654-3843,https://www.minoritybrokers.net/
"Miss Mow It All, Inc. ",2026-05-30 00:00:00,WBE,Contractor,"Professional lawn and landscape services. Design, build and snow removal services",Barbara Hilpp,Jessamine,Nicholasville,KY,859-885-6697,https://www.missmowitall.net/
"Misty Artesian Water, Inc.",2026-02-28 00:00:00,MWBE,Retail,"Bottled water for special events, bottled in bottles in the shape of a ribbon",Misty Washington,Jefferson,Louisville,KY,502-528-6336,https://mistywater.com/
"Mix It Up Mobile Concessions, LLC",2029-04-30 00:00:00,MWBE,Other - Food Truck,"Mobile food truck, mobile concession stand, caterer, bounce houses and inflatables, foam machine, custom t-shirts, balloon garlands, fundraiser opportunities, popcorn, cotton candy, and machine rentals",Leslie Evans,Fayette,Lexington,KY,859-755-6136,https://www.mixitup859.com/
"MMN Consulting, LLC ",2027-10-30 00:00:00,WBE,Consultant,"Provides assistance and support for government procurement related business development including market analysis; strategic planning, capture planning, socio-economic certifications, capability statements, proposal development or review, small business subcontract plan development, implementation & compliance",Marisa Neal,Jefferson,Louisville,KY,502-767-6970,https://www.mmnconsulting.com/
"Montenegro Paper, LTD dba Montenegro, Inc.",2028-05-30 00:00:00,MWBE,Supplier/Distributor,"Provider of paper, packaging & print procurement needs",Irma Bates ,DuPage,Roselle ,IL,630-894-0350,https://montenegro-inc.com/
"Moravec Labs, LLC dba dymaptic",2028-07-30 00:00:00,WBE,Consultant,GIS (Geographic Information Systems) consulting and custom software development,Mara Stoica,,Portland,OR,707-939-5227,https://www.dymaptic.com/
"Morgan Accounting Services, LLC ",2027-06-30 00:00:00,WBE,Professional Services,"Accounting, bookkeeping, consulting & tax services",Patricia L. Morgan ,Jefferson,Louisville,KY,502-821-7509,
"Morgan Security Services, LLC dba Morgan Protection Services",2028-02-28 00:00:00,MBE,Professional Services,Security services,Barron M. Morgan,Jefferson,Louisville,KY,"502-689-2234, 502-515-3313",https://www.morganprotectionusa.com/
"Munson Business Interiors, Inc.",2026-10-30 00:00:00,WBE,Retail,"Office furniture sale, space planning, interior design, corporate standard programs, project management, W/H, furniture service & installation",Mindy D. Munson,Jefferson,Louisville,KY,502-589-1236,https://www.mbifurniture.com/
