"Data Systems Integration Group, Inc.",2028-01-30 00:00:00,MBE,Professional Services,"IT consulting, software, and services",Chad Chalumalla,Franklin,Dublin,OH,614-327-7348,http://www.dsiginc.com/
"DAW Cleaning Services, LLC",2027-05-30 00:00:00,MBE,Subcontractor,"Pressure washing, vinyl and brick cleaning, construction clean-up",Andre Wilson,Fayette,Lexington,KY,859-621-2661,
"DBISP, LLC ",2026-10-30 00:00:00,MBE,Supplier/Distributor,"Provides office, medical, industrial, IT products & technology solutions to federal/city/state government agencies, K-12/university education markets & commercial businesses",John Miller,Hamilton,Cincinnati,OH,317-222-1671,https://www.dbispllc.com/
"DDX Transport, LLC",2028-01-30 00:00:00,MBE,Other ,"Transportation, logistics, and warehousing",Joshua T. “J.T.” Roberts,Kenton,Walton,KY,859-356-3278,http://www.ddxtransport.com/
"Delivery & Distribution Solutions, LLC",2026-08-30 00:00:00,MBE,Non-Professional Services,Courier and logistics services like parcel delivery,Denis Monroe,DuPage,Burr Ridge,IL,708-798-7907,www.deliveryanddistribution.com 
"Distinct Packabilities of Kentucky, LLC dba Distinct Packabilities   ",2028-04-30 00:00:00,WBE,Manufacturer,"Printing, laminating, slitting, bag making",Elizabeth Simon Montgomery,Bullitt,Shepherdsville,KY,502-551-2122,https://distinctpack.com/
"Diversified Systems, Inc.    ",2026-10-30 00:00:00,MBE,Professional Services,Information technology services,"Archie D. Williamson, Jr.",Franklin,Westerville,OH,614-476-9672,https://diversifiedsystems.com/
"DJX Construction Company, LLC",2027-03-30 00:00:00,MBE,Subcontractor,"Heavy civil general contractor specializing in site work (i.e. site demo; clearing; earthwork; embankment; site utilities - sanitary, storm, and water; and site improvements)",James Stocks,Hamilton,Cincinnati,OH,513-577-2323,https://www.djxconstruction.com
"DK Bast Foundation Services, LLC",2027-06-30 00:00:00,WBE,Contractor,Foundation Repairs ,Janet Ragland,Grayson,Leitchfield,KY,615-355-4773,http://www.dkbastfoundation.net/home.html
DLOM Group LLC,2027-05-30 00:00:00,WBE,Contractor,"HVAC duct cleaning, mold remediation and surface and terminal cleaning",Lisa Deaton,Fayette,Lexington,KY,859-230-2068,https://www.dlomgroup.com/
"DLZ Kentucky, Inc.",2028-08-30 00:00:00,MBE,Professional Services,"Consulting architects and engineers for civil, mechanical, electrical, and industrial engineering, environmental testing, asbestos removal, survey, hydraulics, dams, sewers, airports, bridges, hydrology drilling and testing, subdivision management, construction supervision, telephone and gas lines","Vikram Rajadhyaksha, Ram Rajadhyaksha",Fayette,Lexington,KY,859-299-5226,http://www.dlz.com/
"DM Engineers, PLLC ",2026-10-30 00:00:00,MBE,Consultant,"Mechanical, electrical and plumbing consulting engineering services",Mario Mendoza,Queens,Sunnyside,NY,631-275-9362,https://dm-engineers.com/
DM Glass Incorporated,2027-07-30 00:00:00,WBE,Subcontractor,"Fabrication and installation of storefronts, doors, glass, and glazing for new and remodel construction, and repairs",Melanie Martin,,Scottsburg,IN,812-752-4007,https://www.scottsburgglass.com/
"Donna Lawrence Productions, Inc. ",2026-10-30 00:00:00,WBE,Professional Services,Film & video production including special format immersive installations,Donna Lawrence ,Jefferson,Louisville,KY,502-589-9617,https://dlproductions.com/
"Door Services of Indiana, Inc.",2028-10-30 00:00:00,WBE,Subcontractor,"Subcontractor to supply doors, frames, and finish hardware for commercial properties under construction",Angela Peterson,,Franklin,IN,317-780-3800,https://www.dsi-wbe.com/
"Dunrobin Associates, LLC",2028-05-30 00:00:00,WBE,Consultant,Management & technical consulting to public entities involving infrastructure or development ,L. Beth Sutherland,Campbell,Cold Spring,KY,859-781-9776,http://www.dunrobin.org/
"E. Tabb Design Construction & Development, LLC  ",2027-04-30 00:00:00,WBE,Contractor,"Consulting, planning, design, project management and labor of new and existing construction, remodels, and expansions",Alison Snyder,Jefferson,Louisville,KY,502 749-2004,https://etabbllc.com/
"East 7th Street Gift Shop, Inc.   ",2026-08-30 00:00:00,WBE,Retail,"Brick & mortar apothecary shop specializing in loose teas, herbs, soaps, candles, and essential oils",Carisa Bunten,Campbell,Newport,KY,859-655-9444,https://shop.seventhstreetgifts.com/
EasyGo Waste Management LLC,2028-04-30 00:00:00,WBE,Non-Professional Services,"Portable toilet rentals, hand washing stations, hand sanitizer stations, holding tanks and pumping out lift stations and septic tanks",Crystal Stark,Carroll,Carrollton,KY,502-662-0123,https://www.easygowm.com/
"Eckman/Freeman & Associates, Inc.",2027-07-30 00:00:00,WBE,Professional Services,Medical Case Management Services Vocational Rehabilitation Services Utilization Review Services Kentucky MCO,Carol Freeman,Fayette,Lexington,KY,866-227-5002,https://eckmanfreeman.com/
"Edifici, LLC ",2029-04-30 00:00:00,MBE,Other - Real Estate,Affordable housing real estate development,Gabriel Alexander Fitz,Jefferson,Louisville,KY,502-938-2803,
"Element Design, PLLC",2028-12-30 00:00:00,WBE,Professional Services,"Full site design services include landscape architecture, civil engineering, and site planning. Specialties include Master planning, sit analysis & selection, site design and layout, grading & drainage, landscape design, green infrastructure design & LEED documentation, hydraulic analysis & engineering, sanitary sewer engineering, water line distribution engineering, permitting for sit design and civil engineering scope, land planning & zoning",Ramona Fry,Fayette,Lexington,KY,859-389-6533,https://www.element-site.com/
"Elevar Design Group, Inc. dba SFA Architects, Inc.",2028-01-30 00:00:00,MBE,Professional Services,"Complete architectural, engineering, planning, interior design, and project management services",Emilio Thomas Fernandez,Hamilton,Cincinnati,OH,513-721-0600,https://elevar.com/
Elite Pro Building Services LLC,2028-04-30 00:00:00,MBE,Other ,"Cleaning for commercial properties – warehouses, offices, and retail spaces, and floor cleaning services",Robert Meeks,Boone,Florence,KY,859-414-2440,https://www.goelitepro.biz/
"Elm Street Resources, Inc.",2028-04-30 00:00:00,WBE,Broker,Coal supplier/broker,Kathy Walker,Johnson,Paintsville,KY,606-789-4036,
"EMED Medical Company, LLC ",2026-10-30 00:00:00,MBE,Supplier/Distributor,"Medical, dental, and hospital equipment supplies, pharmaceutical preparation manufacturing, drugs & druggists sundries merchant wholesaler",Eric Bailey,St. Louis,Maryland Heights,MO,314-739-6815,https://www.emedmedical.com/
"EMY Consulting Group, LLC                                                                                                 ",2028-07-30 00:00:00,MWBE,Consultant,"Business Planning & Strategy Business plan development, SWOT analysis (Strengths, Weaknesses, Opportunities, Threats), Market research & competitive analysis, Strategic growth planning, Startup consulting, Operations & Process Improvement Workflow analysis & optimization, Policy and procedure development.",Nasira Mah-Jabeen,Jefferson,Louisville,KY,502-579-0170,
"Engaging Solutions, LLC",2028-03-30 00:00:00,MWBE,Consultant,"Fiscal management & accountability, diversity service, community outreach & fund development",Tammy Butler Robinson,Marion,Indianapolis,IN,317-283-8300,https://engagingsolutions.net/
"Eric Cole Realtor, LLC    ",2026-05-30 00:00:00,MBE,Other ,"Buying, selling, leasing, and managing of residential and commercial real estate, as well as property liquidation for ward of the state dependents",Eric Cole,Fayette,Lexington,KY,859-806-8498,www.ericcoleteam.com
eSense Incorporated,2027-03-30 00:00:00,MBE,Professional Services,"Information technology & management consulting, software, web development, QA, testing, IV & V, staffing",Sanjay N. Vaze,Hamilton,Fishers,IN,317-490-2570,http://esense-inc.com/
"Evelez, LLC",2027-12-30 00:00:00,MWBE ,Consultant,"Office administration, data entry, business consulting & staffing, Truck leasing services, Spanish-English interpretation and translation services",Eugenia Velez,Jefferson,Louisville,KY,502-644-2075,
"Everett Elite Consulting, LLC",2029-04-30 00:00:00,MBE,Professional Services,Strategic consulting and operational execution support,Torriaun Everett,,Indianapolis,IN,317-502-0300,https://everettelite.com/
"Executive Residential Elevator, LLC dba Executive Elevator Co.",2028-03-30 00:00:00,MWBE,Contractor,"Elevator service, repair, installations and modernizations",Teru Irvin,Jefferson,Louisville,KY,502-636-1993,https://exelevator.com/
Exousia Financial Solutions LLC,2028-04-30 00:00:00,MWBE,Professional Services,"Financial coaching, business consulting, and credit coaching",Syvoskie Dale Bray Pope,Jefferson,Louisville,KY,502-416-7389,https://syvoskia.com/
"Expedited Transportation Services, Inc.",2027-08-30 00:00:00,WBE,Other,Third party logistics firm handling all aspects of domestic & international transportation of freight,Winford Charlene Taylor,Gwinnett,Stone Mountain,GA,770-413-1700,www.ets-atlanta.com
"Experts in Growth Leadership Consulting, LLC",2026-12-30 00:00:00,MWBE,Consultant,"Consulting, coaching, training, motivational and keynote speaker",Vivian Hairston Blade,Jefferson,Louisville,KY,502-419-2433,https://vivianblade.com/
"F&M, LLC",2026-02-28 00:00:00,MBE,Contractor,Rehab homes and small apartment units,Frederick Liggin,Jefferson,Louisville,KY,502-639-6166,
"Fabulously Fit Fitness, LLC",2029-01-30 00:00:00,MWBE,Other,"Group fitness instructor, fitness event planner, and some fitness apparel retail",Shuntella Whitfield,Fayette,Lexington,KY,859-705-2917,https://www.fabulouslyfitfitness.com/
"Family Again, LLC  ",2028-04-30 00:00:00,MBE,Professional Services,Employment services and supervision for non- master level Cosmetologists as they work towards completing their necessary supervision hours,Michael Parker,Jefferson,Louisville,KY,502-303-7556,
"Fields Electrical Supply Company, Inc.",2028-01-30 00:00:00,MBE,Supplier/Distributor,"Electrical Apparatus and Equipment, Wiring Supplies, and Related Equipment Merchant Wholesalers",Victor Fields,St. Louis,St. Louis,MO,816-387-1364,https://fieldssupplycompany.com/
"Fieldtrip, LLC ",2028-09-30 00:00:00,WBE,Professional Services,"Marketing & advertising services including brand development, media buying creative, digital & related services ",Jane Pfeiffer,Jefferson ,Louisville,KY,502-822-9011,https://wearefieldtrip.com/
"Fineline Graphics, Inc. dba Fineline Printing Group",2028-09-30 00:00:00,MBE ,Manufacturer,"Commercial printing, mailing, fulfillment promotional products",Ricardo 'Richard' Miller ,Marion,Indianapolis,IN,317-872-4490,https://finelineprintinggroup.com/
"First Choice Commercial Services, Inc. ",2027-03-30 00:00:00,WBE,Other ,"Commercial cleaning, construction clean-up, and interior demolition",Charlene Ambach,Jefferson,Louisville,KY,502-957-1810,https://firstchoicecleaning.com/
"First Star Safety, LLC",2027-12-30 00:00:00,WBE,Professional Services,"Construction & traffic safety supply, direct sale, rental & distributer:  Traffic control specialist, MOT plans, detours, closures, pavement markings, flagging. Aluminum traffic control signs manufacturing and sales",Kelly M. Hollatz,Hamilton,Cincinnati,OH,513-661-7827,https://www.firststarsafety.com/
"Five Star Cartage, LLC",2026-02-28 00:00:00,MWBE,Trucking,Providing transportation services to our customers safely and efficiently,Brittany Jones,Jefferson,Louisville,KY,502-810-4529,
"Flooring by Design, LLC",2028-07-30 00:00:00,WBE,Retail,"Full-service flooring company offering design, selection and installation services of all flooring types from tile, hardwood, LVT, carpet and vinyl flooring; commercial projects large and small, multi-family properties, residential and custom homes.",Ashley Anderson,Madison,Richmond,KY,859-358-6441,https://www.flooringbydesignky.com/
"Fox Partners, LLC ",2027-03-30 00:00:00,MBE,Professional Services,"Distributed Antenna Systems (DAS), Cell phone signal boosting systems and equipment sales, service, installation, and maintenance",John L. Fox III/ John L. Fox IV,Scott,Sadieville,KY,859-619-2094,
"Foxx Catering, LLC",2027-04-30 00:00:00,MBE,Other ,Food product manufacturing and full service catering,Travis Foxx,Jefferson,Louisville,KY,810-407-0744,https://www.foxxcatering.com/
Freezin with Aubrie LLC,2028-01-30 00:00:00,WBE,Retail,Freeze dried candy and treats,Cristina Sink,Boone,Florence,KY,859-462-8749,www.freezinwithaubrie.com
"Fuzed Solutions, LLC",2029-01-30 00:00:00,WBE,Contractor,Voice and data security systems maintenance and management,Kristin Abney & Tiffany Abney,Fayette,Lexington,KY,859-339-7280 859-270-5518,https://fuzedsolutions.com/
"Garcia Interiors, LLC",2027-11-30 00:00:00,MWBE,Subcontractor,Specialty commercial construction,Mayrya Garcia,Boone,Walton,KY,513-532-5675,
"Gazelle Logistics Group,  LLC dba Gazelle Mechanical",2026-05-30 00:00:00,MBE,Supplier/Distributor,"HVAC equipment, storage, and delivery","Andrew J. Ellington, III",Hamilton,Cincinnati,OH,888-991-7447,https://www.shipgazelle.com/
"Geisler Domigan Engineers, PLLC",2026-08-30 00:00:00,WBE,Professional Services,"Civil site development, stormwater design, geotechnical engineering, and environmental engineering services",Mary Geisler,Bourbon,Paris,KY,859-494-4540,https://geislerdomiganeng.com/
Giacin Media House LLC,2028-01-30 00:00:00,WBE,Professional Services,"Food and product photography, motion picture, styling and editing services, portrait photography",Sarah Giacin,Kenton,Taylor Mill,KY,513-607-1451,https://www.giacinmediahouse.com/
"Gilbert Oil Co., LLC ",2026-08-30 00:00:00,WBE,Supplier/Distributor,Wholesale fuel products,Amy Gilbert Kennedy,Lewis,Vanceburg,KY,606-202-1074,
"GJC Consultants, LLC",2026-12-30 00:00:00,WBE,Consultant,"Branding, marketing, and storytelling",Henrietta Pepper,Jefferson,Louisville,KY,502-693-1396,https://henriettapepper.com/
"Glenn Lundy, LLC ",2026-10-30 00:00:00,MBE,Consultant,"Bringing (automotive_ dealers together to inspire and grow their businesses using a combination of on-demand training, live weekly training, in-person retreats, helping build a collaborative community and offering one-on-one coaching",Glenn Lundy,Fayette,Lexington,KY,859-567-0333,https://www.glennlundy.com/
"Global Diagnostic Services, Inc.",2026-10-30 00:00:00,MBE,Other,Medical staffing and mobile diagnostic testing,Marc C. Upshaw,Rockdale,Conyers,GA,770-602-0502,https://www.globaldiagnostic.net/
"Global Lofts, LLC",2029-02-28 00:00:00,MWBE,Other ,Lodging accommodations and curated experiences/events within the community,Latasha Ann Brown,Jefferson,Louisville,KY,931-278-3128,https://www.global-lofts.com/
"GMC Logistics, LLC",2026-08-30 00:00:00,MBE,Trucking,Trucking Services,Christopher M. Hall,Jefferson,Louisville,KY,502-656-1027,
"GMJ, LLC",2028-04-30 00:00:00,MBE,Contractor,"Hydroseeding, landscaping, concrete work, silt fencing, trucking, grading, retaining walls, brick paving, tree planting, and excavation",Gerardo Jaime,Breckenridge,Custer,KY,270-536-3700,
"GNC Consulting, Inc. ",2028-08-30 00:00:00,MBE,Consultant,"Custom computer consulting services, installation, upgrade and maintenance of ERP applications. Niche is PeopleSoft, Hyperion Enterprise and Cloud solutions. Including, but not limited to, human resources, payroll, employee benefits, financial procurement, supply, customer relations and incentive compensation systems. An Oracle PeopleSoft Enterprise Platinum partner and Oracle Hyperion Partner",Garry P. Cooper,Will,Frankfort,IL,815-981-4029,https://gnc-consulting.com/
"Go 2 Girl, LLC",2028-09-30 00:00:00,WBE,Professional Services,"Business development, certification, diversity spend tracing reporting requirements, supplier diversity portal registration, trade shows conference ",Vanessa Pennoyer ,Shelby,Shelbyville,KY ,502-303-6030,https://www.go2girl4results.com/
"God Particle IT Group, LLC",2027-10-30 00:00:00,MBE,Consultant,"IT support and consulting, IT engineering for cyber security, networking engineering, and managed services for support desks",Timothy Pruitt,Jefferson,Louisville,KY,502-716-9908,https://www.godparticleit.com/
"Golden Leaves, LLC",2027-10-30 00:00:00,MWBE,Other ,"Tea Cafe offering over 100 loose leaf teas, serving breakfast, lunch and tea parties. Gift shop offering handmade goat milk soap and soy wax candles",Samantha Moran,Madison,Richmond,KY,859-575-1154,www.goldenleavesky.com
Golden Light Inc.,2028-01-30 00:00:00,MWBE,Subcontractor,Providing student transportation (via rideshare model),Ciara Bowman,Jefferson,Louisville,KY,502-314-4250,https://goldenlightdrive.com/
"Gould Electric, LLC",2028-11-30 00:00:00,MBE,Contractor,Electrical contractor,Christopher A. Gould,Jefferson,Louisville,KY,502-741-3804,http://www.gouldelectric.com/
"Grand Luxury Living, LLC",2028-10-30 00:00:00,MWBE,Other ,"Real Estate Units, Leadership Development, Instructional Design & Training",Antionette Davis,Fayette,Lexington,KY,269-519-4837,https://www.grandluxuryliving.com/
"Grantibly, LLC ",2026-08-30 00:00:00,WBE,Professional Services,Evaluation services to faculty with grant funded work and to nonprofits who need to evaluate programs,Lauren McClain,Warren,Bowling Green,KY,419-595-0402 ,https://www.grantibly.com/
"Grayson, LLC dba ADC Paving",2029-01-30 00:00:00,WBE,Contractor,Asphalt paving and maintenance,Angela Bright,Jefferson,Louisville,KY,502-964-1415,https://www.adcpaving.com/
"Green & Associates Realty, LLC ",2026-08-30 00:00:00,WBE,Other ,"Real estate buyer/seller representation, bank asset disposition, and property management",Julie Ann Green,Jefferson,Louisville,KY,502-931-0121,https://exitrealtygreenteamlouisville.com/
"Griggs Enterprises, Inc. ",2027-06-30 00:00:00,WBE,Contractor,Commercial general contractor ,Janie L. Griggs,Bourbon,Paris,KY,859-987-6744,http://griggsent.com/
Grotech Ltd. Co.,2028-01-30 00:00:00,MWBE,Contractor,"Data analytics, design services, IT support, and medical billing",Ashanti Hall,Fayette,Lexington,KY,859-797-8956,https://grotechltd.com/
Gustavo's Mexican Grill Prospect LLC,2029-04-30 00:00:00,MBE,Other - Restaurant,Food products and alcoholic beverages,Gustavo Reyes Torres,Jefferson,Prospect,KY,502-767-4191,https://gustavosmexgrill.com/
"h3 Technologies, LLC",2026-05-30 00:00:00,MWBE,Professional Services,"IT staffing, software development & consulting firm",Anju Kumari,Boone,Florence,KY,859-282-1400,https://www.h3-technologies.com/
Hades Knight Global Inc.,2027-05-30 00:00:00,MBE,Consultant,"Security consulting, both electronic and physical",Nelson T. Muldrow,Fayette,Lexington,KY,859-298-8526,
"Hamilton Enterprises Logistics Partners, LLC (HELP)",2026-05-30 00:00:00,MBE,Supplier/Distributor,"Source & supply uniforms & equipment for public safety professionals, federal, state & local governments & DOD military forces","Sanford P. Hamilton, Jr.",Fayette,Lexington,KY,859-333-5909,
Hardlines Design Company,2026-08-30 00:00:00,MWBE,Professional Services,"Architecture, historic preservation, and planning",Charissa W. Durst,Franklin,Columbus,OH,614-784-8733,https://www.hardlinesdesign.com/
"Harper Slade, LLC",2026-05-30 00:00:00,MWBE,Consultant,"DEI, Racial Equity Index; Training and workshops: The Garden, Harper Slade enResidence; Simulations:  The Experience Experiment",Nikki Lanier,Jefferson,Louisville,KY,502-265-5119,https://www.harperslade.com/
Haykas Properties LLC dba Just Love Coffee Cafe- Berea,2027-07-30 00:00:00,WBE,Retail,Restaurant and coffee shop,Sandy Adams & Hayley Rogers,Madison,Berea,KY,859-756-3089,https://justlovecoffeecafe.com/ky-berea/
"HB Masonry, LLC ",2028-09-30 00:00:00,WBE ,Subcontractor,"Masonry construction, brick, block & stone walls ",Sherry Alexander ,Madison,Richmond,KY ,859-624-0741,https://www.hbmasonryky.com/
"Health Careers Training Institute, LLC",2026-08-30 00:00:00,MWBE,Other ,Proprietary school that trains individuals in Nurse Aide skills and emergency care skills such as CPR and first aid,Michelle Young,Jefferson,Louisville,KY,502-290-2999 ,https://www.hctiky.com/
"Health, Education and Research Associates, Inc.",2028-09-30 00:00:00,MBE,Professional Services,Lab planning services and lab equipment planning.,Taylor Schuman,St. Louis,St. Louis,MO,314-346-3447,https://herainc.com/
"Hearts Matter, LLC ",2026-12-30 00:00:00,MWBE,Other ,"Health education provider, specializing in high quality CPR & emergency cardiac care instruction; provides American Heart Association certification in CPR, first aid & advanced life support; HeartSmart.com partner in Automatic External Defibrillator (AED) sales",Micean Johnikin,Fayette,Lexington,KY,859-309-2950,https://www.heartsmatterllc.com/
Helping Other People Excel - HOPE,2028-11-30 00:00:00,WBE,Consultant,"Leadership development including training, executive coaching & organizational development consulting",Dr. Hope Zoeller,Jefferson,Louisville,KY,502-724-9041,https://hopeforleaders.com/
"Hicks Enterprises, Inc.",2027-05-30 00:00:00,MBE,Other ,"Construction, multi-affordable housing",Keith Hicks,Jefferson,Louisville,KY,502-644-0116,
"High Performance Products LLC dba HPP Industrial
",2027-04-30 00:00:00,WBE,Supplier/Distributor,"Provider of industrial coatings, linings, and floorings for a variety of industries; coatings for infrastructure, food and beverage, water, wastewater, OEM, petrochemical, power generation, and plant maintenance",Pam Sholtes,Jefferson,Jeffersonville,KY,502-451-2226,http://hppindustrial.com/hpp/
"HireEd Brands, LLC dba The College Visit Journal",2026-05-30 00:00:00,MWBE,Other ,"College readiness author and bookseller to individuals, online retailers and wholesale to businesses",Danielle Marshall,Jefferson,Louisville,KY,832-771-8884,https://www.thecollegevisitjournal.com/ 
"Hirons & Company Communications, Inc.",2028-10-30 00:00:00,WBE,Consultant,"Advertising, public relations, digital and web, creative and brand development, crisis communications, paid media, strategy and research, and video and production",Deana Haworth,,Indianapolis,IN,317-977-2206,https://hirons.com/
"HJ Hauling Services, Inc.",2029-01-30 00:00:00,WBE,Subcontractor,Import and export of materials on job sites,Brooke Nusky,,Cincinnati,OH,513-502-5229,https://hjhauling.com/
"Hoeworx, LLC",2027-06-30 00:00:00,WBE,Subcontractor,Construction,Janine Cunningham,Bullitt,Shepherdsville,KY,502-553-8552,https://www.hoeworx.com/
"Home Away from Home Therapeutic Center, LLC",2027-03-30 00:00:00,MWBE,Other ,"Individual and family therapy services, in-person and group therapy services, as well as community events",Dr. Shaquilla NiCole Cooper,Jefferson,Louisville,KY,502-536-7245,https://shaquilla-cooper.clientsecure.me
"Hometown Pharmacy Specialty Services, PLLC",2028-04-30 00:00:00,WBE,Other ,Closed door pharmacy services,MeLeigha Milby & Nelda Eads,Taylor,Campbellsville,KY,270-937-9008,https://www.staywellathometown.com/
"Houston-Johnson, Inc. dba HJI Supply Chain Solutions",2026-10-30 00:00:00,MWBE,Supplier/Distrubutor,"Materials and inventory management, broadcast/inline vehicle sequencing services, sub-assembly kitting, order fulfilling, contract packaging, container management and managed transportation, contract warehousing, and outsourced manufacturing",C. Lynn Houston-Moore,Jefferson,Louisville,KY,502-638-8000,https://hjisolutions.com/
"HR Know-How, LLC ",2028-10-30 00:00:00,MWBE,Consultant,"Executive Coaching, Team Development Training, and HR expertise",Lisa Marie Johnson,Nelson,Bardstown,KY,502-709-0199,https://www.hrknowhow.org/
"HRUNeed, LLC",2029-04-30 00:00:00,MWBE,Consultant,"Coaching and development; business assessment and strategic planning; HR communication, organizational support, employee support and growth, and career services",Shelly Bell,Nelson,Bardstown,KY,502-507-1768,https://www.hruneed.com/
"I.C.O.E. Bracelet, LLC ",2026-10-30 00:00:00,WBE,Other,Custom engraved wristbands; engrave emergency contact numbers on wristbands & add fun designs or allergy & medical alerts,Michele Redmon,Jefferson,Louisville,KY,630-248-4827,https://www.icoebracelets.com/
"Imperial Pixels, LLC",2026-05-30 00:00:00,MBE,Professional Services,"Real estate photography, portraits, team photos, headshots, and drone photography",Brandon Barnhill,Jefferson,Louisville,KY,502-509-8572,https://www.imperialpixels.com/
"Incipio Workforce Solutions, LLC ",2026-10-30 00:00:00,WBE,Professional Services,Contract recruiting and human resources services and behavioral research and development services,Molley Ricketts,Jefferson,Louisville,KY,502-544-3706,https://incipioworks.com/
"Inclusive Realty, LLC",2027-03-30 00:00:00,MWBE,Professional Services,"Home purchases, home sales, commercial real estate and property management",Antecia Whitehead,Jefferson,Louisville,KY,502-314-5725,https://inclusiverealtygroup.com/
"Inclusive Strategies, LLC",2029-04-30 00:00:00,WBE,Consultant,"Supplier diversity, procurement communications, government and public policy consulting",Lesley Crane,,Indianapolis,IN,317-627-4527,https://www.inclusivestrategies.co/
"Indomitable Cleaning, LLC dba Coverall",2028-07-30 00:00:00,MWBE,Other ,"Cleaning services, carpet cleaning, strip and waxing, and window cleaning",Suzette Ferguson- Ngondy,Fayette,Lexington,KY,859-537-1009,
"Induction Therapies, LLC",2027-04-30 00:00:00,WBE,Other ,"Wholesales of a medical device, skin care and personal care products, and retail sales of skin care and personal care products",Angelia Inscoe,Jefferson,Louisville,KY,877-746-4407,https://www.inductiontherapies.com/
"Infinitice, LLC",2029-05-30 00:00:00,MBE,Professional Services,"IT Consulting services for flexible solutions with mobile, web applications, data analytics and providing IT staffing",Siddharth Patel,Jefferson,Louisville,KY,856-332-5527,https://infinitice.com/
