"Sign Language Network, Inc. dba Sign Language Network of KY",2028-01-30 00:00:00,WBE,Professional Services,Sign language and spoken language interpreting and document translation,Connie Meck,Fayette,Lexington,KY,859-629-8084,https://slnofky.com/
"Singleton Road Boring, Inc. ",2026-05-30 00:00:00,WBE,Subcontractor,Bore & jack steel casings underneath state & federal highways for all types of utility lines,Angela Singleton,Pulaski,Burnside,KY,606-872-4142,https://singletonroadboring.com/
SITEK Incorporated ,2028-08-30 00:00:00,MBE,Professional Services,"Custom Software development, Staffing",GaneshBabu Sivagurunathan,Fayette,Lexington,KY,859-327-3331,http://www.siteksolutions.com/ 
"Skip's Defense Solutions, LLC",2028-10-30 00:00:00,MBE,Retail,Firearms and explosives sales,KeOliver Ryon 'Skip' McCall,Jefferson,Louisville,KY,502-931-3172,https://www.skipsdefensesolutions.com
"Sky Roofing, LLC",2027-05-30 00:00:00,MBE,Contractor,"Residential and commercial roofing installation, maintenance, and repairs",Alan Cerdas & Jairo Jinesta (Owners) & Christina Byers (Office Manager),,Goodlettsville,TN,615-535-9722,https://skyroofing-us.com/
"SL Consulting Solutions, LLC",2026-08-30 00:00:00,MWBE,Consultant,"Project management, operations, facilities, strategic planning and facilitation, technology, budgeting, finance accounting, process improvement, leadership training, auditing, business analysis, human resources, recruiting, management, funding sources and cash flow analysis including expediting cash receipts faster.",Stephanie Lackey,Jefferson,Louisville,KY,502-235-6459,https://www.mpruv-u.org/ 
"Smith & Associates Counseling, PLLC",2028-07-30 00:00:00,MWBE,Professional Services,Mental and behavioral health services,Nina Smith,Jefferson,Louisville,KY,502-907-2408,
"Smith Solutions, LLC",2026-08-30 00:00:00,WBE,Consultant,"Consulting, project management, and development services in the affordable housing industry",Danielle Smith,Marion,Indianapolis,IN,612-236-6107,https://www.smithsolved.com/
"Smofitness, LLC",2027-07-30 00:00:00,WBE,Professional Services,"Online fitness and nutrition program,  personal training in person, and custom meal plans",Valerie Smorol,Fayette,Lexington,KY,859-494-1934,https://www.trimbootcamp.org/
"Sol Developments, LLC dba Sol design + consulting",2027-03-30 00:00:00,MBE,Professional Services,"Green building certifications, LEED for homes (Provider QAD & Green Rater), energy performance analysis, energy audit, sustainability-integrated architecture",Sanyog Rathod,Hamilton,Cincinnati,OH,513-455-8228,https://solconsults.com/
"Solid Light, Inc.",2026-08-30 00:00:00,WBE,Other ,"Design and build of visitor experiences that engage, enlighten and inspire.  Our services include master planning, feasibility studies, site evaluations, operational proformas, project management, architectural coordination, concept visualization, design, immersive and interactive media design and production, post-production, shop drawings, exhibit fabrication, and installation",Cynthia Torp Jones,Jefferson,Louisville,KY,502-562-0060,https://solidlight-inc.com/
"Solid Platforms, Inc.",2028-07-30 00:00:00,WBE,Contractor,Scaffold and carpentry services,Susan Lammertin,,Portage,IN,219-405-0908,https://www.solidplatforms.com/
"Something Major Home Improvement, LLC dba Something Major Construction Services, LLC",2028-01-30 00:00:00,MWBE,Contractor,"Consulting and project management of site improvements, remodels, and renovations, installation of flooring and drywall, cleaning and removal of debris from property/project, and lawn care maintenance",DeAnna Bell,Jefferson,Louisville,KY,502-240-7702,
"Southern Trades, Inc.",2026-07-30 00:00:00,WBE,Subcontractor,"Steel erection, heavy rigging, stadium seating, welding, custom metal fabrication,  miscellaneous steel, structural steel, full service millwright, emergency repair, material handling solutions, exotic welding, machinery moving installation, custom maintenance programs & industrial maintenance",Mona Hagen,Jefferson,Louisville,KY,502-448-3445,https://www.southerntradesinc.com/
"Sowful Blessings, LLC dba Cultured Remedy, LLC",2028-04-30 00:00:00,MWBE,Manufacturer,"Manufacturing and distributing dried spices, seasoning mixes, and herbal blends for food preparation, and virtual clearinghouse of resources, strategies, webinars, and other digital technologies for the intercultural development of healthcare systems, providers, and patients",Jitana Benton-Lee,Fayette,Lexington,KY,859-230-9464,https://sowfulblessings.com/
"Spray-Tec, Inc.",2027-04-30 00:00:00,WBE,Contractor,"Commercial roofing, spray applied roofing systems, and commercial roof repairs and maintenance, restoration, replacement and new construction",Kay Jordan,Shelby,Shelbyville,KY,502-633-5499,https://spray-tec.com/
"Springfield Plumbing, Inc.",2029-04-30 00:00:00,MBE,Contractor,Plumbing installation; Design Build,Robert A. Springfield Jr.,Jefferson,Louisville,KY,502-587-8281,https://springfieldplumbingi.com/
"St. Regis Culvert, Inc.",2026-07-30 00:00:00,WBE,Manufacturer,"Manufacture steel drainage products and resell snow plow, grader & construction blades",Jennifer Turner,Eaton,Charlotte,MI,800-527-4604,https://stregisculvert.com/
Star Staffing Solutions Incorporated,2026-12-30 00:00:00,MWBE,Other ,"Temporary, temp to hire and direct hire employees",Sonia Rico,Jefferson,Louisville,KY,502-907-5061,https://www.starstaffingsolution.com/
"Stella Scrub Wear, LLC",2027-03-30 00:00:00,MWBE,Retail,Sales of medical scrubs to all healthcare and medical employees,Tymisha Robinson,Jefferson,Louisville,KY,502-509-3072,https://www.stellascrubwear.com/
"Strategic Communications, LLC",2026-12-30 00:00:00,MWBE,Other ,"Value added reseller and provider of IT, A/V infrastructure, collaboration & security services",Stella K. Mills,Jefferson,Louisville,KY,502-493-7234,https://www.yourstrategic.com/
"Strategic Evaluation Insights, LLC dba Strategic Evaluation Insights",2029-01-30 00:00:00,WBE,Consultant,"Research studies, program evaluation and strategic planning for nonprofits in the social science and education sectors",Leslie Taylor,Jefferson,Prospect,KY,502-802-5864,https://www.strategicevaluationinsights.com/
"Styles Enterprises, LLC dba On Time Trucking, LLC   ",2026-10-30 00:00:00,MWBE,Other,Transportation of general freight and commodities,Darien Styles,Jefferson,Fisherville,KY,502-794-6868,
"Summers Grading Service, LLC",2029-04-30 00:00:00,WBE,Subcontractor,"Erosion control such as seeding, sod, silt fence and straw blowing, and landscaping services such as installing trees and shrubs",Heather Summers,,Charlestown,IN,812-246-4839,https://summersgrading.com/
"Superior Technologies, LLC",2026-12-30 00:00:00,WBE,Contractor,Horizontal directional boring,Jennifer Filiatreau,Nelson,Bardstown,KY,502-827-1713,https://superior-technologies.com/
S-Walk Inc. dba Seven Seas Construction,2029-04-30 00:00:00,MBE,Contractor,"MSE walls, sanitary sewers, culverts, bridge repair, extensive decorative streetscape concrete, flatwork, pavers, permeable pavers",Soran R. Walker,Jefferson,Louisville,KY,502-231-7395,https://sevenseasconstruction.net/
"Sydney Jones VA, LLC dba Sydney Jones",2029-04-30 00:00:00,WBE,Professional Services,"Digital marketing services including: email marketing, social media marketing, content creation, web design, and marketing strategies",Sydney Jones,Bell,Pineville,KY,606-269-4455,
"Synergy Disaster Recovery, LLC",2028-04-30 00:00:00,WBE,Professional Services,Federal grant management services and disaster planning consulting,Bethany Duart,Boulder,Boulder,CO,954-817-7441,https://synergy-dr.com/
"System Support Associates, LLC ",2028-02-28 00:00:00,MBE,Consultant,"Computer network services, computer consulting, system management, supply computer equipment & peripherals  ",Eric Shen,Campbell,Newport,KY,859-212-0550,https://www.sys-sup.com/
"T.E.M. Group, Inc",2027-12-30 00:00:00,MBE,Subcontractor,Electrical Construction ,Thomas Masterson,Jefferson,Louisville,KY,502-454-0101,http://www.temgroupinc.com/
"Tanisha's Mobile Bookkeeping Service, LLC ",2026-05-30 00:00:00,MWBE,Professional Services,"Bookkeeping, payroll & tax preparation",Tanisha D. Durrett,Jefferson,Louisville,KY,502-939-0200,https://tanishasmobilebookkeeping.com/
TCJ Financial Services LLC,2029-04-30 00:00:00,MWBE,Professional Services,"Mobile notary and loan signing services, real estate transaction support (deeds, affidavits, power of attorney, trust documents, and related filings), property management and administrative support services, small business consulting and advisory services",Tiffany Shumake,Jefferson,Louisville,KY,502-415-2334,https://tiffsnotary.com/
"Teache, LLC",2029-04-30 00:00:00,MWBE,Professional Services,"Professional human resources consulting and training development services for public and private sector organizations. Work includes developing HR policies, compliance documentation, onboarding and workforce training materials, as well as designing and building instructional content and learning programs focused on employee development, client engagement, workplace communication, and organizational effectiveness. Services are delivered through scalable, LMS-compatible format.",Christian Colbert,,Columbus,OH,614-540-3123,https://www.teachepro.com/
Tech Smart Solutions LLC,2027-05-30 00:00:00,MBE,Professional Services,"Information technology services, information technology staffing, consulting organizations providing professional resources",Vikram Odedara,,Edison,NJ,551-253-0415,https://tssus.net/
"Tekton Construction, LLC",2028-04-30 00:00:00,MBE,Contractor,General contracting,James Joseph Isaacs,Jessamine,Nicholasville,KY,859-514-0000,https://tekton-builder.com/
"That Should Be a Thing, LLC dba EcoReliant",2029-04-30 00:00:00,WBE,Consultant,Environmental consulting,Kari Wallover,Fayette,Lexington,KY,859-813-2699,https://www.ecoreliant.com/
"The Baddest Stitch, LLC",2026-12-30 00:00:00,MWBE,Retail,"e-commerce store that offers women's clothing, accessories and custom-made clothing",Michelle Miller,Jefferson,Louisville,KY,502-309-9671,https://www.thebaddeststitch.com/
"The Burkins Financial Group, LLC",2026-05-30 00:00:00,MBE,Consultant,"Operational advice and assistance to businesses on administrative management issues such as financial planning and budgeting, equity, and asset management",Ronald L. Burkins,Henderson,Henderson,KY,270-454-9890,https://burkinsfinancial.com/
"The CAM Company, LLC",2028-10-30 00:00:00,MWBE,Broker,Safety hi-vis workwear and PPE supplier,Lynn Cameron,,Westerville,OH,614-402-2831,https://www.thecamcompany.com/
"The Consumer Management Group, LLC",2028-04-30 00:00:00,MWBE,Consultant,"Safety training including environmental, health, and safety services; general management services; debris management implementation operational project management facilities maintenance oversight pre-OSHA compliance; post-OSHA compliance audits/inspections, silica testing hearing conservation, testing, emergency evacuation procedures",Verlaine Lynn, Warren,Bowling Green,KY,270-935-5001,https://www.consumermanagementgroup.com/
"The Dabbu Group, LLC",2026-05-30 00:00:00,MBE,Retail," Alcohol, food, pool and state Keno activities",Ram Paladugu,Campbell,Wilder,KY,(859) 261-7555,www.bamboozgrill.com 
"The Décor Group of Northern KY, Inc.",2026-05-30 00:00:00,WBE,Contractor,"Landscaping, lawn maintenance, interior & exterior holiday decorating & landscape lighting  design & installation",Karralea Stickrod-List,Boone,Hebron,KY,859-586-4784,https://decorgroupnky.com/
"The Delish Dish, LLC",2028-04-30 00:00:00,WBE,Other ,"Full service catering and event planning, jams and jellies manufacturing",Mavis Linnemann-Clark,Kenton,Covington,KY,859-250-0881,https://delishdishcincy.com/
"The Dove Healing Center, LLC",2027-10-30 00:00:00,MWBE,Professional Services,Behavioral health services,LaTeisha Benson,Warren,Bowling Green,KY,270-599-0847,https://www.dovehealingcenter.com/
"The Junction Agency, LLC ",2026-08-30 00:00:00,MWBE,Other ,"360 degree photobooth services, event production services, photo booth services, and accessories",Tiffani Collins,Jefferson,Louisville,KY,502-298-3835,https://www.junction360.net/
"The Language Professor, LLC   ",2026-08-30 00:00:00,MWBE,Professional Services,Tutoring and private tutoring services,Aurelia McNeil,Harrison,Cynthiana,KY,586-785-6150,https://www.thelanguageprofessor.com/
"The Logo Warehouse, LLC",2028-12-30 00:00:00,MWBE,Other,"Promotional products and apparel, screen-printing, embroidery, engraving, and art design services",Leah C. Scott,Jefferson,Louisville,KY,502-708-0634,https://thelogowarehouse.com/
"The Matrix Group, Inc. ",2029-05-30 00:00:00,WBE,Professional Services,Analytical Services: Demographic analysis Statistical analysis Data miningEthnographic/Observational research Field services: Field audits Interviewing Focus groups & in-depth interviews: Usability tests Qualitative Recruiting & Scheduling Participant incentivemanagement Moderating Merchandising audits Mystery shopping programs Project managementOnline research: Online surveys Recruiting for online surveys Questionnaire design,Martha Dereamer,Fayette,Lexington,KY,859-263-8177,https://www.tmgresearch.com/
"The Write Solution, LLC",2028-04-30 00:00:00,WBE,Professional Services,Public relations agency and communication,Kym Voorhees Raque,Jefferson,Louisville,KY,502-593-2329,http://www.thewritesolutionllc.com/
Thea's Bass & Biddy Kitchen L.L.C.,2027-05-30 00:00:00,MWBE,Retail,Upscale food bar and catering services made with signature seasonings and made from scratch recipes,Thea Mason,Fayette,Lexington,KY,859-490-8366,www.bassandbiddy.com
"Third Rock Consultants, LLC",2029-04-30 00:00:00,WBE,Consultant,Environmental analysis & design; environmental construction/site restoration; water quality monitoring/analysis; ecological surveys/analysis,Molly Foree,Fayette,Lexington,KY,859-977-2000,https://www.thirdrockconsultants.com/
"Tikur Solutions, LLC",2026-10-30 00:00:00,MWBE,Professional Services,"Professional Services of Owners Technical Representative, CMC project manager/project engineer augmenting and strategic planning for transition and move management",Davita Johnson,Marion,Indianapolis,IN,317-402-7994,https://tikursolutions.com/
"TLQ Vending Services, LLC",2029-05-30 00:00:00,MBE,Other ,"Vending operations, not just limited to food delivery systems, not limited to state and federal government buildings",Todd Stephens,Fayette,Lexington,KY,859-433-5023,https://www.tlq-vendingservices.com/
Tobacco Rose Farm Construction & Development Services Limited ,2027-06-30 00:00:00,WBE,Contractor,"Landscaping services, concrete work, snow plowing, silt fencing, erosion control",Shelia Baker,Fayette,Lexington,KY,859-264-9905,https://www.tobaccorose.com/
"Tomorrow's Recruiting, LLC",2028-04-30 00:00:00,MWBE,Professional Services,"Direct hire placement, HR consulting, coaching, resume writing, and sourcing",LaToya Barber,Jefferson,Louisville,KY,502-208-6986,https://www.tomorrowsrecruiting.com/
"Tomrook Steel, LLC",2027-04-30 00:00:00,WBE,Manufacturer,"Structural steel and miscellaneous steel fabrication, including stairs, mezzanines, handrails, pipe bollards, and structural steel frame work",Brooke Cecil,Nelson,Bardstown,KY,502-349-9126,https://tomrook.com/
"Toni Levy & Associates, Inc.",2026-06-30 00:00:00,MWBE,Supplier/Distributor,"Electrical & plumbing supplies; accounting, auditing, bookkeeping, CPA & tax services",Toni Levy,Jefferson,Louisville,KY,502-566-3030,http://tonilevya.com/
"Top Steele Reinforcing, Inc.",2027-03-30 00:00:00,MBE,Contractor,"Foundation, structure, and building exterior",Rogelio Cervantes Hinojosa,Boone,Walton,KY,859-803-2148,"Please provide website address, if applicable"
"Tracking Solutions, Inc.",2026-02-28 00:00:00,WBE,Professional Services,GPS & alcohol monitoring equipment for the criminal justice system,Kristen Zachary,Rutherford,Murfreesboro,TN,615-337-9367,https://www.trackingsolutionsnow.com/
"Trauma Informed Counseling Center, LLC    ",2026-10-30 00:00:00,MWBE,Professional Services,"Counseling, group therapy, trainings, and consultation",Dr. Lauren Downey,Fayette,Lexington,KY,859-213-2890,https://www.theticcoflexington.com/
"Tree of the Field, LLC",2027-05-30 00:00:00,WBE,Retail,"Skeeterlog, RediFlame Fire Logs, Fiber Flame Grillers, Pit Kit KY Bourbon Barrel Logs",Donna Robin Richmond Mason,Garrard,Paint Lick,KY,859-582-5028,https://www.treeofthefield.com/
"Tretter Financial Planning, LLC ",2028-09-30 00:00:00,WBE ,Professional Services,"Comprehensive financial planningincluding: investment management, retirement planning, tax planning, beneficiary planning,charitable giving, social security analysis, employer stock management, debt reduction strategies,cash management, education funding, and insurance needs analysis",Jessica Tretter ,Jefferson ,Louisville,KY,502-387-7123,https://www.tretterfinancialplanning.com/
Tri Citi Janitorial And Maid Service LLC,2028-01-30 00:00:00,MBE,Contractor,"Janitorial Services; and the firm’s primary services are Janitorial, carpet and upholstery cleaning, building interior and exterior cleaning, including pressure washing.",Carl Hobson,Christian,Hopkinsville,KY,270-498-5222,https://tricitijanitorial.com/
"Tri-A Solutions, LLC",2026-08-30 00:00:00,WBE,Contractor,"Form and pour concrete walls, pads, sidewalks, barn floors, and feed pads",Teresa Flaugher,Pendleton,Butler,KY,859-322-4578,https://tri-a.net/
"Tri-State Plastics, Inc.",2028-07-30 00:00:00,WBE,Manufacturer,High performance plastics machined and fabricated,Lisa Schneider,Kenton,Latonia,KY,859-655-8200,https://www.tristateplastics.com/
Tsubaki Group LLC,2029-01-30 00:00:00,MWBE,Contractor,"Residential construction, infill development, property rehabilitation, and project management",Blanca Cheung,Jessamine,Nicholasville,KY,859-913-3150,
TT Investment Corp,2028-01-30 00:00:00,MBE,Other ,Buying property and renovate for rental properties,Antonio Goins,Jefferson,Louisville,KY,502-287-2290,
TTHawkins Transportation LLC,2028-08-30 00:00:00,MBE,Trucking,"Trucking industry, delivery of freight, equipment, machinery, and vehicles",Terrill T. Hawkins,Fayette,Lexington,KY,,https://www.tthawkinstransportation.com/
"Unique Essentials, LLC",2026-05-30 00:00:00,MWBE,Retail,"Natural based hair care, mixed, manufactured, and distributed locally and nationally for consumer and wholesale use",Benea Durrett,Jefferson,Louisville,KY,502-298-1921,https://www.essentiallyuniquesalon.com/
"United American Supply, LLC",2027-03-30 00:00:00,MBE,Supplier/Distributor,Distribute personal & industrial safety supplies & janitorial supplies,Arleta Taylor,Jessamine,Nicholasville,KY,859-881-1850,http://www.unitedamericansupply.com/
"Unlimited Graphics, INC.",2026-05-30 00:00:00,WBE,Other,"Commercial screen printing, embroidery, offset printing & promotional products",Shari Damron,Ballard,LaCenter,KY,270-665-5750,https://www.unlimitedgraphics.com/
"Valu-Tech, Inc. dba VT Design Solutions ",2026-08-30 00:00:00,MBE,Professional Services,"Leveraging CAD technology to provide design services for commercial and government customers, including AutoCAD, ReVit, and other programs",Al Wofford,Hamilton,Cincinnati,OH,937-476-2220,https://www.vt-designs.com/
Vanderbur Industrial Products Incorporated,2029-04-30 00:00:00,WBE,Supplier,Distributor/supplier of Division 10 specialties in commercial construction,Sue Vanderbur Jenkins,Jefferson,Prospect,KY,502-550-1483,Vanderbur.com
Vani LLC dba Subway 4260,2027-03-30 00:00:00,MWBE,Retail,"Sandwich shop, salads, soda, chips, and cookies",Bhavna Patel,Jefferson,Louisville,KY,502-379-3907,"Please provide website address, if applicable"
"VBH Consulting, LLC dba The Hardin Group",2027-05-30 00:00:00,WBE,Consultant,Inspiring and developing leaders and workplaces to perform at their highest potential,Mia Vitale Hardin,Fayette,Lexington,KY,256-348-2055,https://vitaleandco.com/
"Vergence, LLC",2027-07-30 00:00:00,MBE,Professional Services,"IT and healthcare staffing, technology solutions and government contracting",Gabe Browne,,Indianapolis,IN,317-508-1699,https://www.vergencegroup.com/
"VIC Enterprises, Inc.",2028-11-30 00:00:00,WBE,Contractor,"General Contractor, grade & drain, demolition, tree trimming, concrete, bridges not more than 100', seeding & protection, tree removal",Vicki J. Penny,Calloway,Murray,KY,270-210-5324,
"VisionSPEAK Consulting, LLC",2027-03-30 00:00:00,MWBE,Consultant,"Kingdom Life Coaching, Vision Strategy Coaching and Consulting, Personal and Professional Development Consulting and Workshop Facilitation, Motivational Speaking, Author",Dr. Candice Johnson,Jefferson,Louisville,KY,502-718-6095,https://www.visionspeakconsulting.com/
"Vividus Labs, LLC",2029-01-30 00:00:00,MWBE,Consultant,Data strategy and evaluation,"Alisia Maria McClain
Tim McClain",Jefferson,Louisville,KY,"502-876-8759
502-494-4311",https://www.vividuslabs.com/
"VLo & Company, LLC dba AJ Construction",2028-01-30 00:00:00,MWBE,Subcontractor,"Metal stud framing, drywall installation and finish and acoustical ceilings",Veronica Lopez,Spencer,Taylorsville,KY,502-544-0462,
"VPS Architecture, P.C.",2027-06-30 00:00:00,WBE,Professional Services,"Architecture design, interior design, project planning, feasibility studies  ",Sarah A. Schuler,Vanderburgh,Evansville,IN,812-423-7729,https://vpsarch.com/
"VS Engineering, Inc.",2029-01-30 00:00:00,MBE,Professional Services,"Engineering services for transportation, bridges & other structures, traffic signals, signing & lighting, water resources, survey & right of way, construction inspection, and environmental services",Sanjay Patel,,Indianapolis,IN,317-293-3542,https://www.vsengineering.com/
"V-Soft Consulting Group, Inc.",2028-09-30 00:00:00,MWBE,Professional Services,"IT staffing, managed services, IT business solutions and IT engineering, custom application development, systems and software assessments, infrastructure design and installation, and upgrades and implementations",Radhika Veeramachaneni,Jefferson,Louisville,KY,502-425-8425,https://www.vsoftconsulting.com/
"Vym, LLC",2028-01-30 00:00:00,WBE,Consultant,"Strategic consulting in philanthropy; public health; social & behavior change; and monitoring, evaluation, research, and learning",Catherine Harbour,Fayette,Lexington,KY,859-567-9667,
"Walker Flags Since 1960, Inc.",2028-07-30 00:00:00,WBE,Retail,"Flags, flagpoles, finials and flag accessories",Donna Walker Mancini,Jefferson,Louisville,KY,502-394-1974,https://www.walkerflags.com/store/catalog
"Walker Healthforce, LLC",2029-02-28 00:00:00,MWBE,Professional Services,"Contract staffing services across all IT Healthcare application categories from core clinical & patient data platforms to complex billing environments including ambulatory & inpatient systems, clinical & revenue  cycle implementation, electronic medical records (EMR) & financial & billing systems; IT and Healthcare technology staff augmentation services to healthcare payer & provider organizations",Tifiany Walker,Oakland,Bloomfield Hills,MI,248-809-5854,https://walkerhealthforce.com/
Wallace Barber Insurance Agency,2026-10-30 00:00:00,MBE,Professional Services,Insurance and financial services,Wallace Barber,Fayette,Lexington,KY,859-543-0300,https://wallacebarber.com/
"WAMCO, Inc.",2028-10-30 00:00:00,MBE,Contractor,"Asphalt, paving, grade work, seal and striping",Tremaine Wooldridge,Pulaski,Somerset,KY,606-416-4968,https://www.facebook.com/wooldridgeasphalt/
"Warner Transportation, LLC",2027-03-30 00:00:00,MBE,Trucking,"Pick-up and drop-off goods to and from any state, interstate election",Terrell S. Warner,Fayette,Lexington,KY,859-489-7348,https://warnertransportation.net/
Warren Technology Incorporated,2028-08-30 00:00:00,WBE,Contractor,"telecommunications, IT services, closed circuit television (CCTV), door access and audio/visual (AV)",Jenny Warren,Jefferson,Louisville,KY,502-639-9687,https://warrentechnology.com/
"Waterleaf Solutions, LLC",2026-08-30 00:00:00,WBE,Consultant,"Business writing, technical writing, educational materials, document preparation, and business consulting",Melissa Frazier,Campbell,Newport,KY,859-760-3579,https://waterleafsolutions.com/
"Watts Real Estate Consulting and Development, LLC  ",2026-08-30 00:00:00,MBE,Consultant,"Provide services for the efforts of creating and fostering affordable housing, including consulting, development, and property management",Bruce Watts,,Norfolk,VA,757-650-0361,http://wattsrealestatedevelopment.com/
"WDi Architecture, Inc.",2028-01-30 00:00:00,MWBE,Professional Services,"High quality architectural, planning, and design, and construction administration services for a wide variety of new and renovation projects. Our innovative, sustainable designs assignments include commercial, institutional, multi-family housing, and mixed-development",Daryl Williams-Dotson,Marion,Indianapolis,IN,317-716-1433,https://wdiarchitecture.com/
"Weber and Associates, Inc. DBA Design 27",2028-04-30 00:00:00,WBE,Consultant,"Working with architects, facility and business owners to design all low voltage systems including structured cabling, telecom, audio visual, access control, video security, and  instrusion",Meri Weber,,Indianapolis,IN,317-536-8000,https://design27.com/
"Wellness Creative, LLC",2028-09-30 00:00:00,WBE ,Professional Services,Music therapy services ,Amber Colliver ,Fayette ,Lexington,KY ,859-287-4111,https://wellnessmtc.com/
"West Indies Family Cleaning, LLC",2026-08-30 00:00:00,MWBE,Non-Professional Services,Residential and commercial cleaning,Marie Abigail Etienne,Jefferson,Louisville,KY,502-544-9237,
"West Lou Coffee, LLC",2026-12-30 00:00:00,MBE,Retail,"Wholesale coffee roaster for restaurants, cafes, and grocery stores, as well as online coffee sales",Sean L. Roberson,Jefferson,Louisville,KY,678-852-1555,https://westloucoffee.com/home
